screening,Cites,Authors,Title,Year,Source,Publisher,ArticleURL,CitesURL,GSRank,QueryDate,Type,DOI,ISSN,CitationURL,Volume,Issue,StartPage,EndPage,ECC,CitesPerYear,CitesPerAuthor,AuthorCount,Age,Abstract,FullTextURL,RelatedURL
,13,L Pham,"Transferring, transforming, ensembling: the novel formula of identifying fake news",2019,Proceedings of the 12th ACM International …,people.eng.unimelb.edu.au,https://people.eng.unimelb.edu.au/jianzhongq/wsdm19-cup-reports/reports/report1.pdf,"https://scholar.google.com/scholar?cites=8622893982627715013&as_sdt=2005&sciodt=0,5&hl=en",483,3/2/23 10:43,PDF,,,,,,,,13,3.25,13,1,4,"… fake news is sowing confusion and posing a big threat to our human being society, the accurate and efficient solutions of fake news … 88.298 and 88.098 weighted accuracy in the private …",https://people.eng.unimelb.edu.au/jianzhongq/wsdm19-cup-reports/reports/report1.pdf,"https://scholar.google.com/scholar?q=related:xddgImSsqncJ:scholar.google.com/&scioq=%22fake+news%22%7C%22false+news%22%7C%22false+stor*%22+%22accuracy%22%7C%22discernment%22%7C%22credibility%22%7C%22belief%22%7C%22suceptib*%22&hl=en&as_sdt=0,5&as_vis=1"
,6,"K Nagashri, J Sangeetha",Fake news detection using passive-aggressive classifier and other machine learning algorithms,2021,"… : Proceedings of CoCoNet 2020, Volume 2",Springer,https://link.springer.com/chapter/10.1007/978-981-33-6987-0_19,"https://scholar.google.com/scholar?cites=7749800624707555918&as_sdt=2005&sciodt=0,5&hl=en",484,3/2/23 10:43,,10.1007/978-981-33-6987-0_19,,,,,,,6,3.00,3,2,2,… The term frequency–inverse document frequency (TFIDF) is used for identifying fake news on … accuracy of 77.2% for identifying the fake news with PCFG showing minor effects on recall. …,,"https://scholar.google.com/scholar?q=related:TlLLo5vSjGsJ:scholar.google.com/&scioq=%22fake+news%22%7C%22false+news%22%7C%22false+stor*%22+%22accuracy%22%7C%22discernment%22%7C%22credibility%22%7C%22belief%22%7C%22suceptib*%22&hl=en&as_sdt=0,5&as_vis=1"
,21,"R Varma, Y Verma, P Vijayvargiya, ...",A systematic survey on deep learning and machine learning approaches of fake news detection in the pre-and post-COVID-19 pandemic,2021,International Journal of …,emerald.com,https://www.emerald.com/insight/content/doi/10.1108/IJICC-04-2021-0069/full/html,"https://scholar.google.com/scholar?cites=6412355463356972181&as_sdt=2005&sciodt=0,5&hl=en",485,3/2/23 10:43,,10.1108/IJICC-04-2021-0069,,,,,,,21,10.50,5,4,2,"… The only study to analyze unsupervised machine learning for fake news detection, the setting gives the best accuracy for k-means algorithm in unsupervised learning (88.7% at k = 20) …",,"https://scholar.google.com/scholar?q=related:lXzt3lFD_VgJ:scholar.google.com/&scioq=%22fake+news%22%7C%22false+news%22%7C%22false+stor*%22+%22accuracy%22%7C%22discernment%22%7C%22credibility%22%7C%22belief%22%7C%22suceptib*%22&hl=en&as_sdt=0,5&as_vis=1"
,184,"S Sommariva, C Vamos, A Mantzarlis, ...",Spreading the (fake) news: exploring health messages on social media and the implications for health professionals using a case study,2018,American journal of …,Taylor &Francis,https://www.tandfonline.com/doi/abs/10.1080/19325037.2018.1473178,"https://scholar.google.com/scholar?cites=6609100543413181231&as_sdt=2005&sciodt=0,5&hl=en",486,3/2/23 10:43,,10.1080/19325037.2018.1473178,,,,,,,184,36.80,46,4,5,… ) as platforms to engage in the correction of “fake news” has been documented widely. More … February 2016 and January 2017 was conducted to verify accuracy (phase 1). Phase 1 was …,https://shapeamerica.tandfonline.com/doi/pdf/10.1080/19325037.2018.1473178,"https://scholar.google.com/scholar?q=related:L9v7fu09uFsJ:scholar.google.com/&scioq=%22fake+news%22%7C%22false+news%22%7C%22false+stor*%22+%22accuracy%22%7C%22discernment%22%7C%22credibility%22%7C%22belief%22%7C%22suceptib*%22&hl=en&as_sdt=0,5&as_vis=1"
,17,T Mould,A Doubt-centered Approach to contemporary legend and Fake news,2018,Journal of American Folklore,scholarlypublishingcollective.org,https://scholarlypublishingcollective.org/uip/jaf/article-abstract/131/522/413/227102,"https://scholar.google.com/scholar?cites=10955828579167960748&as_sdt=2005&sciodt=0,5&hl=en",487,3/2/23 10:43,,,,,,,,,17,3.40,17,1,5,… distinction between fake news and legend to hinge on credibility and adoption. Fake news describes a story intentionally and knowingly made up. legend requires credibility and the …,,"https://scholar.google.com/scholar?q=related:rP5g2QvsCpgJ:scholar.google.com/&scioq=%22fake+news%22%7C%22false+news%22%7C%22false+stor*%22+%22accuracy%22%7C%22discernment%22%7C%22credibility%22%7C%22belief%22%7C%22suceptib*%22&hl=en&as_sdt=0,5&as_vis=1"
,5,"R Muda, G Pennycook, D Pieńkosz, M Białek",People are worse at detecting fake news in their foreign language,2021,,osf.io,https://osf.io/p8su6/download,"https://scholar.google.com/scholar?cites=14982516949295777465&as_sdt=2005&sciodt=0,5&hl=en",488,3/2/23 10:43,PDF,,,,,,,,5,2.50,1,4,2,"… belief in fake news and other forms of epistemically suspect beliefs such as conspiratorial beliefs, delusional ideation or belief in … and intuitions supports belief in fake news, what triggers …",https://osf.io/p8su6/download,"https://scholar.google.com/scholar?q=related:uUYL3MiX7M8J:scholar.google.com/&scioq=%22fake+news%22%7C%22false+news%22%7C%22false+stor*%22+%22accuracy%22%7C%22discernment%22%7C%22credibility%22%7C%22belief%22%7C%22suceptib*%22&hl=en&as_sdt=0,5&as_vis=1"
,119,"K Hartley, MK Vu",Fighting fake news in the COVID-19 era: policy insights from an equilibrium model,2020,Policy Sciences,Springer,https://link.springer.com/article/10.1007/s11077-020-09405-z,"https://scholar.google.com/scholar?cites=6002320732556277691&as_sdt=2005&sciodt=0,5&hl=en",489,3/2/23 10:43,HTML,10.1007/s11077-020-09405-z,,,,,,,119,39.67,60,2,3,"… fake news, including content shared through social media, compromise the efficacy of evidence-based policy interventions and undermine the credibility … when encountering fake news. …",https://link.springer.com/article/10.1007/s11077-020-09405-z,"https://scholar.google.com/scholar?q=related:u7f6k-eGTFMJ:scholar.google.com/&scioq=%22fake+news%22%7C%22false+news%22%7C%22false+stor*%22+%22accuracy%22%7C%22discernment%22%7C%22credibility%22%7C%22belief%22%7C%22suceptib*%22&hl=en&as_sdt=0,5&as_vis=1"
,2,"AB Siddikk, RJ Lia, MF Muntasir, ...",FakeTouch: Machine Learning Based Framework for Detecting Fake News,2022,Big Data Intelligence for …,Springer,https://link.springer.com/chapter/10.1007/978-3-030-87954-9_15,"https://scholar.google.com/scholar?cites=6617902042248171994&as_sdt=2005&sciodt=0,5&hl=en",490,3/2/23 10:43,,10.1007/978-3-030-87954-9_15,,,,,,,2,2.00,1,4,1,… A combination of these classification models is also examined and evaluated to check the enhancement of the accuracy to classify or identify the fake news. The techniques are …,,"https://scholar.google.com/scholar?q=related:2tGIItiC11sJ:scholar.google.com/&scioq=%22fake+news%22%7C%22false+news%22%7C%22false+stor*%22+%22accuracy%22%7C%22discernment%22%7C%22credibility%22%7C%22belief%22%7C%22suceptib*%22&hl=en&as_sdt=0,5&as_vis=1"
,636,"DA Scheufele, NM Krause","Science audiences, misinformation, and fake news",2019,Proceedings of the National …,National Acad Sciences,https://www.pnas.org/doi/abs/10.1073/pnas.1805871115,"https://scholar.google.com/scholar?cites=8821958579461797882&as_sdt=2005&sciodt=0,5&hl=en",491,3/2/23 10:43,,10.1073/pnas.1805871115,,,,,,,636,159.00,318,2,4,"… could be used to justify belief in misinformation [and that] elite discourse about ‘fake news’ may … actual news stories without facilitating the identification of fake news” (30). Consequently, …",https://www.pnas.org/doi/full/10.1073/pnas.1805871115,"https://scholar.google.com/scholar?q=related:-rcHWJbkbXoJ:scholar.google.com/&scioq=%22fake+news%22%7C%22false+news%22%7C%22false+stor*%22+%22accuracy%22%7C%22discernment%22%7C%22credibility%22%7C%22belief%22%7C%22suceptib*%22&hl=en&as_sdt=0,5&as_vis=1"
,21,"CG Cușmaliuc, LG Coca, A Iftene","Identifying fake news on twitter using naive bayes, SVM and random forest distributed algorithms",2018,… of The 13th Edition of the …,academia.edu,https://www.academia.edu/download/61222668/ConsILR2018_v220191114-18260-185ie9v.pdf,"https://scholar.google.com/scholar?cites=14327153553288284732&as_sdt=2005&sciodt=0,5&hl=en",492,3/2/23 10:43,PDF,,,,,,,,21,4.20,7,3,5,"… fake users and of fake news and it is often difficult to distinguish the credibility of news that appears … The present paper aims to analyze different techniques of detecting fake news, their …",https://www.academia.edu/download/61222668/ConsILR2018_v220191114-18260-185ie9v.pdf,"https://scholar.google.com/scholar?q=related:PEo5ij9G1MYJ:scholar.google.com/&scioq=%22fake+news%22%7C%22false+news%22%7C%22false+stor*%22+%22accuracy%22%7C%22discernment%22%7C%22credibility%22%7C%22belief%22%7C%22suceptib*%22&hl=en&as_sdt=0,5&as_vis=1"
,96,"S Altay, AS Hacquin, H Mercier",Why do so few people share fake news? It hurts their reputation,2022,new media &society,journals.sagepub.com,https://journals.sagepub.com/doi/pdf/10.1177/1461444820969893,"https://scholar.google.com/scholar?cites=12960146975344609893&as_sdt=2005&sciodt=0,5&hl=en",493,3/2/23 10:43,,10.1177/1461444820969893,,,,,,,96,96.00,32,3,1,… or individual) suffers when sharing one fake news story against a background of … fake news. A comparison with real-world media outlets showed that only sources sharing no fake news …,https://www.researchgate.net/profile/Sacha-Altay-2/publication/346311907_Why_do_so_Few_People_Share_Fake_News_It_Hurts_Their_Reputation/links/5fbe1835458515b7976a5e11/Why-do-so-Few-People-Share-Fake-News-It-Hurts-Their-Reputation.pdf,"https://scholar.google.com/scholar?q=related:ZcpEHgKx27MJ:scholar.google.com/&scioq=%22fake+news%22%7C%22false+news%22%7C%22false+stor*%22+%22accuracy%22%7C%22discernment%22%7C%22credibility%22%7C%22belief%22%7C%22suceptib*%22&hl=en&as_sdt=0,5&as_vis=1"
,86,"JP Posadas-Durán, H Gómez-Adorno, ...",Detection of fake news in a new corpus for the Spanish language,2019,Journal of Intelligent …,content.iospress.com,https://content.iospress.com/articles/journal-of-intelligent-and-fuzzy-systems/ifs179034,"https://scholar.google.com/scholar?cites=6209664563690088045&as_sdt=2005&sciodt=0,5&hl=en",494,3/2/23 10:43,,,,,,,,,86,21.50,29,3,4,… Results of fake news detection on the test set in terms of accuracy (%) when classifiers are … Results of fake news detection on the test set in terms of accuracy (%) when classifiers are …,https://www.researchgate.net/profile/Helena-Gomez-Adorno/publication/333098973_Detection_of_fake_news_in_a_new_corpus_for_the_Spanish_language/links/5e3064c8a6fdccd965732362/Detection-of-fake-news-in-a-new-corpus-for-the-Spanish-language.pdf,"https://scholar.google.com/scholar?q=related:bSYUPQUpLVYJ:scholar.google.com/&scioq=%22fake+news%22%7C%22false+news%22%7C%22false+stor*%22+%22accuracy%22%7C%22discernment%22%7C%22credibility%22%7C%22belief%22%7C%22suceptib*%22&hl=en&as_sdt=0,5&as_vis=1"
,50,"S Krishnan, M Chen",Identifying tweets with fake news,2018,… on Information Reuse and Integration (IRI …,ieeexplore.ieee.org,https://ieeexplore.ieee.org/abstract/document/8424744/,"https://scholar.google.com/scholar?cites=11077258052336737234&as_sdt=2005&sciodt=0,5&hl=en",495,3/2/23 10:43,,,,,,,,,50,10.00,25,2,5,"… In [15], a web application is presented to checN the credibility of … over source credibility and information credibility studied in [3], … public to validate tweet credibility and view associated …",,"https://scholar.google.com/scholar?q=related:0tvdPoJTupkJ:scholar.google.com/&scioq=%22fake+news%22%7C%22false+news%22%7C%22false+stor*%22+%22accuracy%22%7C%22discernment%22%7C%22credibility%22%7C%22belief%22%7C%22suceptib*%22&hl=en&as_sdt=0,5&as_vis=1"
,120,"Z Zhao, J Zhao, Y Sano, O Levy, H Takayasu, ...",Fake news propagates differently from real news even at early stages of spreading,2020,EPJ data …,epjds.epj.org,https://epjds.epj.org/articles/epjdata/abs/2020/01/13688_2020_Article_224/13688_2020_Article_224.html,"https://scholar.google.com/scholar?cites=2997352972885115225&as_sdt=2005&sciodt=0,5&hl=en",496,3/2/23 10:43,,10.1140/epjds/s13688-020-00224-z,,,,,,,120,40.00,20,6,3,"… the accuracy of fake news targeting [20–22]. Very recently, based on empirical datasets, it has been found that the propagation network of fake news … to differentiate fake news from real …",https://link.springer.com/content/pdf/10.1140/epjds/s13688-020-00224-z.pdf,"https://scholar.google.com/scholar?q=related:WUFH76W8mCkJ:scholar.google.com/&scioq=%22fake+news%22%7C%22false+news%22%7C%22false+stor*%22+%22accuracy%22%7C%22discernment%22%7C%22credibility%22%7C%22belief%22%7C%22suceptib*%22&hl=en&as_sdt=0,5&as_vis=1"
,117,"O Ajao, D Bhowmik, S Zargari",Sentiment aware fake news detection on online social networks,2019,ICASSP 2019-2019 IEEE …,ieeexplore.ieee.org,https://ieeexplore.ieee.org/abstract/document/8683170/,"https://scholar.google.com/scholar?cites=8405224771717776118&as_sdt=2005&sciodt=0,5&hl=en",497,3/2/23 10:43,,,,,,,,,117,29.25,39,3,4,"… to show that fake news and rumors could be predicted achieving hight accuracy without prior … [14] also used a text-based approach for fake news detection but considered the test, …",https://www.storre.stir.ac.uk/bitstream/1893/28867/1/Fake_News_ICASSP_2019_camera_ready.pdf,"https://scholar.google.com/scholar?q=related:9kKNp2VbpXQJ:scholar.google.com/&scioq=%22fake+news%22%7C%22false+news%22%7C%22false+stor*%22+%22accuracy%22%7C%22discernment%22%7C%22credibility%22%7C%22belief%22%7C%22suceptib*%22&hl=en&as_sdt=0,5&as_vis=1"
,20,"L Wu, Y Rao",Adaptive interaction fusion networks for fake news detection,2020,arXiv preprint arXiv:2004.10009,arxiv.org,https://arxiv.org/abs/2004.10009,"https://scholar.google.com/scholar?cites=6941293756536971060&as_sdt=2005&sciodt=0,5&hl=en",498,3/2/23 10:43,,,,,,,,,20,6.67,10,2,3,"… Furthermore, fake news has greater virality than true … for fake news detection, which have achieved great success. Generally, they devise different modules to capture different credibility …",https://arxiv.org/pdf/2004.10009,"https://scholar.google.com/scholar?q=related:NN8FIOVtVGAJ:scholar.google.com/&scioq=%22fake+news%22%7C%22false+news%22%7C%22false+stor*%22+%22accuracy%22%7C%22discernment%22%7C%22credibility%22%7C%22belief%22%7C%22suceptib*%22&hl=en&as_sdt=0,5&as_vis=1"
,27,"R Kumari, A Ekbal",Amfb: Attention based multimodal factorized bilinear pooling for multimodal fake news detection,2021,Expert Systems with Applications,Elsevier,https://www.sciencedirect.com/science/article/pii/S0957417421008320,"https://scholar.google.com/scholar?cites=12752991904731966416&as_sdt=2005&sciodt=0,5&hl=en",499,3/2/23 10:43,,,,,,,,,27,13.50,14,2,2,… Multimodality increases the accuracy and efficiency of a fake news detection system. … fake news content on social media is one of the considerable challenges in our society. Fake news …,,"https://scholar.google.com/scholar?q=related:0Cv7sJG6-7AJ:scholar.google.com/&scioq=%22fake+news%22%7C%22false+news%22%7C%22false+stor*%22+%22accuracy%22%7C%22discernment%22%7C%22credibility%22%7C%22belief%22%7C%22suceptib*%22&hl=en&as_sdt=0,5&as_vis=1"
,26,"S Vijayaraghavan, Y Wang, Z Guo, J Voong, ...",Fake news detection with different models,2020,arXiv preprint arXiv …,arxiv.org,https://arxiv.org/abs/2003.04978,"https://scholar.google.com/scholar?cites=5045433778101539548&as_sdt=2005&sciodt=0,5&hl=en",500,3/2/23 10:43,,,,,,,,,26,8.67,5,5,3,… news articles as real news or “fake news”. Fake news is misinformation masked under the guise of … the credibility of the fake news which is considered to be quite reliable and accurate7. …,https://arxiv.org/pdf/2003.04978,"https://scholar.google.com/scholar?q=related:3NJ_EUr7BEYJ:scholar.google.com/&scioq=%22fake+news%22%7C%22false+news%22%7C%22false+stor*%22+%22accuracy%22%7C%22discernment%22%7C%22credibility%22%7C%22belief%22%7C%22suceptib*%22&hl=en&as_sdt=0,5&as_vis=1"
,88,"G Bhatt, A Sharma, S Sharma, A Nagpal, ...","Combining neural, statistical and external features for fake news stance identification",2018,… Proceedings of the The …,dl.acm.org,https://dl.acm.org/doi/abs/10.1145/3184558.3191577,"https://scholar.google.com/scholar?cites=7168866121907632847&as_sdt=2005&sciodt=0,5&hl=en",501,3/2/23 10:43,,10.1145/3184558.3191577,,,,,,,88,17.60,18,5,5,"… numerous aspects of credibility of online information. For example, [4] applied the time-sensitive supervised approach by relying on the tweet content to address the credibility of a tweet …",https://dl.acm.org/doi/pdf/10.1145/3184558.3191577,"https://scholar.google.com/scholar?q=related:z_qibsHtfGMJ:scholar.google.com/&scioq=%22fake+news%22%7C%22false+news%22%7C%22false+stor*%22+%22accuracy%22%7C%22discernment%22%7C%22credibility%22%7C%22belief%22%7C%22suceptib*%22&hl=en&as_sdt=0,5&as_vis=1"
,58,"AM Guess, D Lockett, B Lyons, JM Montgomery, ...",“Fake news” may have limited effects beyond increasing beliefs in false claims,2020,,ore.exeter.ac.uk,https://ore.exeter.ac.uk/repository/handle/10871/124798,"https://scholar.google.com/scholar?cites=15846833942268174878&as_sdt=2005&sciodt=0,5&hl=en",502,3/2/23 10:43,,,,,,,,,58,19.33,12,5,3,"… one false article on respondent belief in the claim expressed in the other false article from the figure. In one of four cases, exposure to a false article decreased belief in the other claim (…",https://ore.exeter.ac.uk/repository/bitstream/handle/10871/124798/V2_nyhan_fakenews_jan29-1.pdf?sequence=2,"https://scholar.google.com/scholar?q=related:HmJ_p4JD69sJ:scholar.google.com/&scioq=%22fake+news%22%7C%22false+news%22%7C%22false+stor*%22+%22accuracy%22%7C%22discernment%22%7C%22credibility%22%7C%22belief%22%7C%22suceptib*%22&hl=en&as_sdt=0,5&as_vis=1"
,18,"SM Shifath, MF Khan, M Islam",A transformer based approach for fighting COVID-19 fake news,2021,arXiv preprint arXiv:2101.12027,arxiv.org,https://arxiv.org/abs/2101.12027,"https://scholar.google.com/scholar?cites=5400385566352105594&as_sdt=2005&sciodt=0,5&hl=en",503,3/2/23 10:43,,,,,,,,,18,9.00,6,3,2,"… In this work, we have presented our overall workflow for the fake news detection task. We have … Our method achieves comparative accuracy on the test dataset and therefore helps us to …",https://arxiv.org/pdf/2101.12027,"https://scholar.google.com/scholar?q=related:emCQZA8G8koJ:scholar.google.com/&scioq=%22fake+news%22%7C%22false+news%22%7C%22false+stor*%22+%22accuracy%22%7C%22discernment%22%7C%22credibility%22%7C%22belief%22%7C%22suceptib*%22&hl=en&as_sdt=0,5&as_vis=1"
,15,"S Schwarz, A Theóphilo, ...",Emet: Embeddings from multilingual-encoder transformer for fake news detection,2020,ICASSP 2020-2020 IEEE …,ieeexplore.ieee.org,https://ieeexplore.ieee.org/abstract/document/9054673/,"https://scholar.google.com/scholar?cites=9561784283835073564&as_sdt=2005&sciodt=0,5&hl=en",504,3/2/23 10:43,,,,,,,,,15,5.00,5,3,3,"… We see that the addition of trustworthy news content improves the accuracy significantly and that … in terms of accuracy, presenting a modest reduction in precision, recall, and F1 metrics. …",,"https://scholar.google.com/scholar?q=related:HATnSCVIsoQJ:scholar.google.com/&scioq=%22fake+news%22%7C%22false+news%22%7C%22false+stor*%22+%22accuracy%22%7C%22discernment%22%7C%22credibility%22%7C%22belief%22%7C%22suceptib*%22&hl=en&as_sdt=0,5&as_vis=1"
,130,"H Wasserman, D Madrid-Morales","An exploratory study of “fake news” and media trust in Kenya, Nigeria and South Africa",2019,African Journalism Studies,Taylor &Francis,https://www.tandfonline.com/doi/abs/10.1080/23743670.2019.1627230,"https://scholar.google.com/scholar?cites=15545296436713547818&as_sdt=2005&sciodt=0,5&hl=en",505,3/2/23 10:43,,10.1080/23743670.2019.1627230,,,,,,,130,32.50,65,2,4,"… However, while our data cannot describe with absolute accuracy the three countries, it should provide a robust picture of how educated citizens deal with “fake news”. We believe the …",,"https://scholar.google.com/scholar?q=related:Kuh0Jr_8u9cJ:scholar.google.com/&scioq=%22fake+news%22%7C%22false+news%22%7C%22false+stor*%22+%22accuracy%22%7C%22discernment%22%7C%22credibility%22%7C%22belief%22%7C%22suceptib*%22&hl=en&as_sdt=0,5&as_vis=1"
,54,"C Song, K Shu, B Wu",Temporally evolving graph neural network for fake news detection,2021,Information Processing &Management,Elsevier,https://www.sciencedirect.com/science/article/pii/S0306457321001965,"https://scholar.google.com/scholar?cites=8797584808366970538&as_sdt=2005&sciodt=0,5&hl=en",506,3/2/23 10:43,,,,,,,,,54,27.00,18,3,2,"… The proliferation of fake news on social media has the … Most of the existing propagation-based fake news detection … temporal propagation-based fake news detection framework, which …",http://www.cs.iit.edu/~kshu/files/IPM_TGNN.pdf,"https://scholar.google.com/scholar?q=related:qhYWiMVMF3oJ:scholar.google.com/&scioq=%22fake+news%22%7C%22false+news%22%7C%22false+stor*%22+%22accuracy%22%7C%22discernment%22%7C%22credibility%22%7C%22belief%22%7C%22suceptib*%22&hl=en&as_sdt=0,5&as_vis=1"
,17,"Y Lin, YC Zhang, D Oyserman",Seeing meaning even when none may exist: Collectivism increases belief in empty claims.,2022,Journal of Personality and Social …,psycnet.apa.org,https://psycnet.apa.org/doiLanding?doi=10.1037/pspa0000280,"https://scholar.google.com/scholar?cites=5794010534083969274&as_sdt=2005&sciodt=0,5&hl=en",507,3/2/23 10:43,,10.1037/pspa0000280,,,,,,,17,17.00,6,3,1,"… H1, operationalizing belief in empty claims as belief in fake news. We also tested corollaries of H1: having false memories about having seen newly generated fake news before (Study …",https://doi.apa.org/doiLanding?doi=10.1037%2Fpspa0000280,"https://scholar.google.com/scholar?q=related:-kDy_OF1aFAJ:scholar.google.com/&scioq=%22fake+news%22%7C%22false+news%22%7C%22false+stor*%22+%22accuracy%22%7C%22discernment%22%7C%22credibility%22%7C%22belief%22%7C%22suceptib*%22&hl=en&as_sdt=0,5&as_vis=1"
,45,"J Pepp, E Michaelson, RK Sterken",What's new about fake news,2019,J. Ethics &Soc. Phil.,HeinOnline,https://heinonline.org/hol-cgi-bin/get_pdf.cgi?handle=hein.journals/jetshy16&section=9,"https://scholar.google.com/scholar?cites=10721174895524008434&as_sdt=2005&sciodt=0,5&hl=en",508,3/2/23 10:43,,,,,,,,,45,11.25,15,3,4,"… newer types of fake news (like Pizzagate) reveal is that fake news can arise … 'belief in their status as genuine news.s Further, it maybe that those who consume and spread fake news …",https://www.diva-portal.org/smash/get/diva2:1422899/FULLTEXT01.pdf,"https://scholar.google.com/scholar?q=related:8lGLpsNDyZQJ:scholar.google.com/&scioq=%22fake+news%22%7C%22false+news%22%7C%22false+stor*%22+%22accuracy%22%7C%22discernment%22%7C%22credibility%22%7C%22belief%22%7C%22suceptib*%22&hl=en&as_sdt=0,5&as_vis=1"
,114,"DN Rapp, NA Salovich",Can't we just disregard fake news? The consequences of exposure to inaccurate information,2018,Policy Insights from the Behavioral …,journals.sagepub.com,https://journals.sagepub.com/doi/pdf/10.1177/2372732218785193,"https://scholar.google.com/scholar?cites=2230155830109296688&as_sdt=2005&sciodt=0,5&hl=en",509,3/2/23 10:43,,10.1177/2372732218785193,,,,,,,114,22.80,57,2,5,"… But when participants possess little insight into the credibility of their partner, they use their partner’s inaccurate contributions as much as if they had evidence of that partner’s credibility. …",https://www.researchgate.net/profile/Nikita-Salovich/publication/327479180_Can%27t_We_Just_Disregard_Fake_News_The_Consequences_of_Exposure_to_Inaccurate_Information/links/5ce4187d299bf14d95af269a/Cant-We-Just-Disregard-Fake-News-The-Consequences-of-Exposure-to-Inaccurate-Information.pdf,"https://scholar.google.com/scholar?q=related:MFhuX-ka8x4J:scholar.google.com/&scioq=%22fake+news%22%7C%22false+news%22%7C%22false+stor*%22+%22accuracy%22%7C%22discernment%22%7C%22credibility%22%7C%22belief%22%7C%22suceptib*%22&hl=en&as_sdt=0,5&as_vis=1"
,232,"Y Yang, L Zheng, J Zhang, Q Cui, Z Li, ...",TI-CNN: Convolutional neural networks for fake news detection,2018,arXiv preprint arXiv …,arxiv.org,https://arxiv.org/abs/1806.00749,"https://scholar.google.com/scholar?cites=719946437561413967&as_sdt=2005&sciodt=0,5&hl=en",510,3/2/23 10:43,,,,,,,,,232,46.40,39,6,5,"… Such kinds of fake news sometimes can bring about devastating effects, and an important goal in improving the credibility of online social networks is to identify the fake news timely. In …",https://arxiv.org/pdf/1806.00749,"https://scholar.google.com/scholar?q=related:T_EndHjD_QkJ:scholar.google.com/&scioq=%22fake+news%22%7C%22false+news%22%7C%22false+stor*%22+%22accuracy%22%7C%22discernment%22%7C%22credibility%22%7C%22belief%22%7C%22suceptib*%22&hl=en&as_sdt=0,5&as_vis=1"
,3,"S Mhatre, A Masurkar",A hybrid method for fake news detection using cosine similarity scores,2021,2021 International Conference on …,ieeexplore.ieee.org,https://ieeexplore.ieee.org/abstract/document/9510134/,"https://scholar.google.com/scholar?cites=6229757858730189271&as_sdt=2005&sciodt=0,5&hl=en",511,3/2/23 10:43,,,,,,,,,3,1.50,2,2,2,… that the second approach shows good improvement in the accuracy of fake news detection. … in the accuracy of Passive aggressive classifier is observed which is most used in fake news …,,"https://scholar.google.com/scholar?q=related:16FPDsSLdFYJ:scholar.google.com/&scioq=%22fake+news%22%7C%22false+news%22%7C%22false+stor*%22+%22accuracy%22%7C%22discernment%22%7C%22credibility%22%7C%22belief%22%7C%22suceptib*%22&hl=en&as_sdt=0,5&as_vis=1"
