screening,Cites,Authors,Title,Year,Source,Publisher,ArticleURL,CitesURL,GSRank,QueryDate,Type,DOI,ISSN,CitationURL,Volume,Issue,StartPage,EndPage,ECC,CitesPerYear,CitesPerAuthor,AuthorCount,Age,Abstract,FullTextURL,RelatedURL
,1001,"G Pennycook, TD Cannon, DG Rand",Prior exposure increases perceived accuracy of fake news.,2018,Journal of experimental …,psycnet.apa.org,https://psycnet.apa.org/record/2018-46919-001,"https://scholar.google.com/scholar?cites=5449145933178933069&as_sdt=2005&sciodt=0,5&hl=en",1,3/2/23 10:43,,,,,,,,,1001,200.20,334,3,5,"… We next sought to assess the robustness of our finding that repetition increases perceptions of fake news accuracy by making two important changes to the design of Study 2. First, we …",https://psycnet.apa.org/manuscript/2018-46919-001.pdf,"https://scholar.google.com/scholar?q=related:TQ9l_FpBn0sJ:scholar.google.com/&scioq=%22fake+news%22%7C%22false+news%22%7C%22false+stor*%22+%22accuracy%22%7C%22discernment%22%7C%22credibility%22%7C%22belief%22%7C%22suceptib*%22&hl=en&as_sdt=0,5&as_vis=1"
,239,N Rochlin,Fake news: belief in post-truth,2017,Library hi tech,emerald.com,https://www.emerald.com/insight/content/doi/10.1108/LHT-03-2017-0062/full/html,"https://scholar.google.com/scholar?cites=16721427312942353642&as_sdt=2005&sciodt=0,5&hl=en",2,3/2/23 10:43,,10.1108/LHT-03-2017-0062,,,,,,,239,39.83,239,1,6,"… combat the epidemic of fake news – compiling lists of fake news sites, flagging … fake news – show a fundamental misunderstanding of the issue. The misunderstanding is that fake news …",,"https://scholar.google.com/scholar?q=related:6oxxFYxxDugJ:scholar.google.com/&scioq=%22fake+news%22%7C%22false+news%22%7C%22false+stor*%22+%22accuracy%22%7C%22discernment%22%7C%22credibility%22%7C%22belief%22%7C%22suceptib*%22&hl=en&as_sdt=0,5&as_vis=1"
,227,"C Martel, G Pennycook, DG Rand",Reliance on emotion promotes belief in fake news,2020,Cognitive research: principles and …,Springer,https://link.springer.com/article/10.1186/s41235-020-00252-3,"https://scholar.google.com/scholar?cites=15276658714213199970&as_sdt=2005&sciodt=0,5&hl=en",3,3/2/23 10:43,HTML,10.1186/s41235-020-00252-3,,,,,,,227,75.67,76,3,3,"… of fake news on the average Americans’ overall media consumption, fake news may still impact the belief in … Here, we explore the psychology underlying belief in blatantly false (and …",https://link.springer.com/article/10.1186/s41235-020-00252-3,"https://scholar.google.com/scholar?q=related:YrCNTymYAdQJ:scholar.google.com/&scioq=%22fake+news%22%7C%22false+news%22%7C%22false+stor*%22+%22accuracy%22%7C%22discernment%22%7C%22credibility%22%7C%22belief%22%7C%22suceptib*%22&hl=en&as_sdt=0,5&as_vis=1"
,41,"K Bryanov, V Vziatysheva",Determinants of individuals' belief in fake news: A scoping review determinants of belief in fake news,2021,PLoS One,journals.plos.org,https://journals.plos.org/plosone/article?id=10.1371/journal.pone.0253717,"https://scholar.google.com/scholar?cites=3674502151914498338&as_sdt=2005&sciodt=0,5&hl=en",4,3/2/23 10:43,HTML,,,,,,,,41,20.50,21,2,2,… to fake news can … accuracy-promoting interventions such as warnings or nudges priming individuals to think about information veracity can impact judgements about fake news credibility…,https://journals.plos.org/plosone/article?id=10.1371/journal.pone.0253717,"https://scholar.google.com/scholar?q=related:IqlFIz10_jIJ:scholar.google.com/&scioq=%22fake+news%22%7C%22false+news%22%7C%22false+stor*%22+%22accuracy%22%7C%22discernment%22%7C%22credibility%22%7C%22belief%22%7C%22suceptib*%22&hl=en&as_sdt=0,5&as_vis=1"
,21,"JP Baptista, E Correia, A Gradim, V Piñeiro-Naval",The influence of political ideology on fake news belief: The Portuguese case,2021,Publications,mdpi.com,https://www.mdpi.com/1127140,"https://scholar.google.com/scholar?cites=15611168029088398493&as_sdt=2005&sciodt=0,5&hl=en",5,3/2/23 10:43,,,,,,,,,21,10.50,5,4,2,"… persuasion with the belief and spread of fake news is the object of … The results show the belief and dissemination of (fake) news … fake news, regardless of whether it is pro-left or pro-right …",https://www.mdpi.com/2304-6775/9/2/23/pdf,"https://scholar.google.com/scholar?q=related:nby_ZpwCptgJ:scholar.google.com/&scioq=%22fake+news%22%7C%22false+news%22%7C%22false+stor*%22+%22accuracy%22%7C%22discernment%22%7C%22credibility%22%7C%22belief%22%7C%22suceptib*%22&hl=en&as_sdt=0,5&as_vis=1"
,309,"AM Guess, M Lerner, B Lyons, ...",A digital media literacy intervention increases discernment between mainstream and false news in the United States and India,2020,Proceedings of the …,National Acad Sciences,https://www.pnas.org/doi/abs/10.1073/pnas.1920498117,"https://scholar.google.com/scholar?cites=18184641724017888888&as_sdt=2005&sciodt=0,5&hl=en",6,3/2/23 10:43,,10.1073/pnas.1920498117,,,,,,,309,103.00,77,4,3,… “tips” on how to spot false news to people in 14 countries. Our … perceived accuracy of both mainstream and false news head… improved discernment between mainstream and false news …,https://www.pnas.org/syndication/doi/10.1073/pnas.1920498117,"https://scholar.google.com/scholar?q=related:eE7VN03TXPwJ:scholar.google.com/&scioq=%22fake+news%22%7C%22false+news%22%7C%22false+stor*%22+%22accuracy%22%7C%22discernment%22%7C%22credibility%22%7C%22belief%22%7C%22suceptib*%22&hl=en&as_sdt=0,5&as_vis=1"
,70,"N Sitaula, CK Mohan, J Grygiel, X Zhou, ...",Credibility-based fake news detection,2020,… fake news in social media …,Springer,https://link.springer.com/chapter/10.1007/978-3-030-42699-6_9,"https://scholar.google.com/scholar?cites=12037902865198137871&as_sdt=2005&sciodt=0,5&hl=en",7,3/2/23 10:43,,10.1007/978-3-030-42699-6_9,,,,,,,70,23.33,14,5,3,"… analysis of credibility based on the source of the news and Sect. 5 details credibility factors … on source and content credibility, we build predictive models to detect fake news, which we …",https://arxiv.org/pdf/1911.00643,"https://scholar.google.com/scholar?q=related:D8LKWOA4D6cJ:scholar.google.com/&scioq=%22fake+news%22%7C%22false+news%22%7C%22false+stor*%22+%22accuracy%22%7C%22discernment%22%7C%22credibility%22%7C%22belief%22%7C%22suceptib*%22&hl=en&as_sdt=0,5&as_vis=1"
,38,"B Bharali, AL Goswami","Fake news: Credibility, cultivation syndrome and the new age media",2017,Media watch,indianjournals.com,https://www.indianjournals.com/ijor.aspx?target=ijor:mw&volume=9&issue=1&article=009,"https://scholar.google.com/scholar?cites=9159136970975786693&as_sdt=2005&sciodt=0,5&hl=en",8,3/2/23 10:43,,,,,,,,,38,6.33,19,2,6,"… , attempts have been made by theorists to define the fake news syndrome. We call it as syndrome, as fake news has certain associated characteristics like short life span of fake news …",https://hcommons.org/deposits/view/hc:39744/CONTENT/fake-news-credibility-cultivation-syndrome.pdf/,"https://scholar.google.com/scholar?q=related:xbYoRIzKG38J:scholar.google.com/&scioq=%22fake+news%22%7C%22false+news%22%7C%22false+stor*%22+%22accuracy%22%7C%22discernment%22%7C%22credibility%22%7C%22belief%22%7C%22suceptib*%22&hl=en&as_sdt=0,5&as_vis=1"
,12,"T Diehl, S Lee","Testing the cognitive involvement hypothesis on social media:'News finds me'perceptions, partisanship, and fake news credibility",2022,Computers in Human Behavior,Elsevier,https://www.sciencedirect.com/science/article/pii/S0747563221004441,"https://scholar.google.com/scholar?cites=1431723486743753003&as_sdt=2005&sciodt=0,5&hl=en",9,3/2/23 10:43,,,,,,,,,12,12.00,6,2,1,"… a role in one's ability to correctly identify fake news. Since high NFMP individuals lack the … the credibility of fake news headlines, b) the NFMP and credibility assessments of fake news, …",,"https://scholar.google.com/scholar?q=related:K_Hx8-yA3hMJ:scholar.google.com/&scioq=%22fake+news%22%7C%22false+news%22%7C%22false+stor*%22+%22accuracy%22%7C%22discernment%22%7C%22credibility%22%7C%22belief%22%7C%22suceptib*%22&hl=en&as_sdt=0,5&as_vis=1"
,339,"B Bago, DG Rand, G Pennycook","Fake news, fast and slow: Deliberation reduces belief in false (but not true) news headlines.",2020,Journal of experimental …,psycnet.apa.org,https://psycnet.apa.org/doiLanding?doi=10.1037/xge0000729,"https://scholar.google.com/scholar?cites=754969678274595315&as_sdt=2005&sciodt=0,5&hl=en",10,3/2/23 10:43,,10.1037/xge0000729,,,,,,,339,113.00,113,3,3,"… Our data suggest that, in the context of fake news, deliberation facilitates accurate belief … that promotes belief in fake news, while deliberation results in greater truth discernment (…",https://dspace.mit.edu/bitstream/handle/1721.1/130414/manuscript_fake_new_fast_slow_01.07.pdf?sequence=2&isAllowed=y,"https://scholar.google.com/scholar?q=related:84m_IewwegoJ:scholar.google.com/&scioq=%22fake+news%22%7C%22false+news%22%7C%22false+stor*%22+%22accuracy%22%7C%22discernment%22%7C%22credibility%22%7C%22belief%22%7C%22suceptib*%22&hl=en&as_sdt=0,5&as_vis=1"
,335,"K Clayton, S Blair, JA Busam, S Forstner, J Glance, ...",Real solutions for fake news? Measuring the effectiveness of general warnings and fact-check tags in reducing belief in false stories on social media,2020,Political behavior,Springer,https://link.springer.com/article/10.1007/s11109-019-09533-0,"https://scholar.google.com/scholar?cites=2040923492784418243&as_sdt=2005&sciodt=0,5&hl=en",11,3/2/23 10:43,,10.1007/s11109-019-09533-0,,,,,,,335,111.67,56,6,3,"… belief in false news. Specifically, we test the effects of both a general warning about false news … to a general warning about false news modestly reduces the perceived accuracy of false …",https://topicminer.hse.ru/rsf2019/literature/fakenews/Clayton%2520et%2520al_2019_Real%2520Solutions%2520for%2520Fake%2520News.pdf,"https://scholar.google.com/scholar?q=related:wy0qeRrRUhwJ:scholar.google.com/&scioq=%22fake+news%22%7C%22false+news%22%7C%22false+stor*%22+%22accuracy%22%7C%22discernment%22%7C%22credibility%22%7C%22belief%22%7C%22suceptib*%22&hl=en&as_sdt=0,5&as_vis=1"
,390,"MV Bronstein, G Pennycook, A Bear, DG Rand, ...","Belief in fake news is associated with delusionality, dogmatism, religious fundamentalism, and reduced analytic thinking",2019,Journal of applied …,Elsevier,https://www.sciencedirect.com/science/article/pii/S2211368118301050,"https://scholar.google.com/scholar?cites=6488342269549633983&as_sdt=2005&sciodt=0,5&hl=en",12,3/2/23 10:43,,,,,,,,,390,97.50,78,5,4,"… two related forms of thinking may protect against belief in fake news: The first, actively open-… predicts increased belief in fake news, and may help to explain belief in fake news among …",https://dspace.mit.edu/bitstream/handle/1721.1/135512/SSRN-id3172140.pdf?sequence=2&isAllowed=y,"https://scholar.google.com/scholar?q=related:v2Go3eo4C1oJ:scholar.google.com/&scioq=%22fake+news%22%7C%22false+news%22%7C%22false+stor*%22+%22accuracy%22%7C%22discernment%22%7C%22credibility%22%7C%22belief%22%7C%22suceptib*%22&hl=en&as_sdt=0,5&as_vis=1"
,45,"A Pereira, J Van Bavel",Identity concerns drive belief in fake news,2018,Unpublished manuscript: https …,scholar.archive.org,https://scholar.archive.org/work/izubzde22zherpqmtmhlfdnf34/access/wayback/https://files.osf.io/v1/resources/7vc5d/providers/osfstorage/5b97ae10715bea00174ed0df?action=download&direct&version=2,"https://scholar.google.com/scholar?cites=5384088539376058689&as_sdt=2005&sciodt=0,5&hl=en",13,3/2/23 10:43,PDF,,,,,,,,45,9.00,23,2,5,Fake news represents a threat to our democracies because it impedes citizens from being appropriately informed. Evidence suggests that fake news spreads more rapidly than real …,https://scholar.archive.org/work/izubzde22zherpqmtmhlfdnf34/access/wayback/https://files.osf.io/v1/resources/7vc5d/providers/osfstorage/5b97ae10715bea00174ed0df?action=download&direct&version=2,"https://scholar.google.com/scholar?q=related:QQHDHAAguEoJ:scholar.google.com/&scioq=%22fake+news%22%7C%22false+news%22%7C%22false+stor*%22+%22accuracy%22%7C%22discernment%22%7C%22credibility%22%7C%22belief%22%7C%22suceptib*%22&hl=en&as_sdt=0,5&as_vis=1"
,39,"C Yuan, Q Ma, W Zhou, J Han, S Hu","Early detection of fake news by utilizing the credibility of news, publishers, and users based on weakly supervised learning",2020,arXiv preprint arXiv:2012.04233,arxiv.org,https://arxiv.org/abs/2012.04233,"https://scholar.google.com/scholar?cites=10875104997518824477&as_sdt=2005&sciodt=0,5&hl=en",14,3/2/23 10:43,,,,,,,,,39,13.00,8,5,3,"… fake news detection and credibility prediction tasks. In this way, we can explicitly exploit the credibility of publishers and users for early fake news … fake news in 4 hours with an accuracy …",https://arxiv.org/pdf/2012.04233,"https://scholar.google.com/scholar?q=related:HVQvYGAi7JYJ:scholar.google.com/&scioq=%22fake+news%22%7C%22false+news%22%7C%22false+stor*%22+%22accuracy%22%7C%22discernment%22%7C%22credibility%22%7C%22belief%22%7C%22suceptib*%22&hl=en&as_sdt=0,5&as_vis=1"
,96,"NM Brashier, G Pennycook, ...",Timing matters when correcting fake news,2021,Proceedings of the …,National Acad Sciences,https://www.pnas.org/doi/abs/10.1073/pnas.2020043118,"https://scholar.google.com/scholar?cites=6916370046556313799&as_sdt=2005&sciodt=0,5&hl=en",15,3/2/23 10:43,,10.1073/pnas.2020043118,,,,,,,96,48.00,32,3,2,"… This mechanism explains why corrections rarely reinforce the original false belief (ie, … fake news impacts discernment 1 wk later. Participants were exposed to 18 true and 18 false news …",https://www.pnas.org/doi/full/10.1073/pnas.2020043118,"https://scholar.google.com/scholar?q=related:xxgksOnh-18J:scholar.google.com/&scioq=%22fake+news%22%7C%22false+news%22%7C%22false+stor*%22+%22accuracy%22%7C%22discernment%22%7C%22credibility%22%7C%22belief%22%7C%22suceptib*%22&hl=en&as_sdt=0,5&as_vis=1"
,33,"B Singh, DK Sharma",Predicting image credibility in fake news over social media using multi-modal approach,2022,Neural Computing and Applications,Springer,https://link.springer.com/article/10.1007/s00521-021-06086-4,"https://scholar.google.com/scholar?cites=17233506463148730660&as_sdt=2005&sciodt=0,5&hl=en",16,3/2/23 10:43,HTML,10.1007/s00521-021-06086-4,,,,,,,33,33.00,17,2,1,… and Twitter are the top two platforms in spreading fake news. Fake images and videos are the key material in the broadcast of fake news. Fake images gather more attention than text [4]…,https://link.springer.com/article/10.1007/s00521-021-06086-4,"https://scholar.google.com/scholar?q=related:JOlgOtK2Ke8J:scholar.google.com/&scioq=%22fake+news%22%7C%22false+news%22%7C%22false+stor*%22+%22accuracy%22%7C%22discernment%22%7C%22credibility%22%7C%22belief%22%7C%22suceptib*%22&hl=en&as_sdt=0,5&as_vis=1"
,44,"A Anthony, R Moulding",Breaking the news: Belief in fake news and conspiracist beliefs,2019,Australian journal of psychology,Taylor &Francis,https://www.tandfonline.com/doi/abs/10.1111/ajpy.12233,"https://scholar.google.com/scholar?cites=13991690093365917736&as_sdt=2005&sciodt=0,5&hl=en",17,3/2/23 10:43,,10.1111/ajpy.12233,,,,,,,44,11.00,22,2,4,"… CTs), in this study we wished to examine whether CT belief, and factors linked in recent studies to CT belief, were a factor underlying FN belief, particularly FN with a conspiratorial bent. …",https://www.tandfonline.com/doi/pdf/10.1111/ajpy.12233?needAccess=true&role=button,"https://scholar.google.com/scholar?q=related:KHhtPgJ4LMIJ:scholar.google.com/&scioq=%22fake+news%22%7C%22false+news%22%7C%22false+stor*%22+%22accuracy%22%7C%22discernment%22%7C%22credibility%22%7C%22belief%22%7C%22suceptib*%22&hl=en&as_sdt=0,5&as_vis=1"
,38,"G Pennycook, DG Rand",Assessing the effect of “disputed” warnings and source salience on perceptions of fake news accuracy,2017,… Network https://papers. ssrn. com/sol3 …,scholar.archive.org,https://scholar.archive.org/work/pbwu7vydcfc2tkm2lngeptqbhq/access/wayback/https://poseidon01.ssrn.com/delivery.php?ID=407026027094100097094096024116000109116084085079093023074103118105026108117066068010048042116060045034000102113119005096081030000017091018092098094077077097066022026014048001103113085116103097086127067075030100066115125001018079067102102029077073075003&EXT=pdf,"https://scholar.google.com/scholar?cites=9233072704865827347&as_sdt=2005&sciodt=0,5&hl=en",18,3/2/23 10:43,PDF,,,,,,,,38,6.33,19,2,6,… techniques for combating belief in fake news? Tagging fake … on perceptions of accuracy across seven experiments (total N… did significantly reduce their perceived accuracy relative to a …,https://scholar.archive.org/work/pbwu7vydcfc2tkm2lngeptqbhq/access/wayback/https://poseidon01.ssrn.com/delivery.php?ID=407026027094100097094096024116000109116084085079093023074103118105026108117066068010048042116060045034000102113119005096081030000017091018092098094077077097066022026014048001103113085116103097086127067075030100066115125001018079067102102029077073075003&EXT=pdf,"https://scholar.google.com/scholar?q=related:E_rhxrR2IoAJ:scholar.google.com/&scioq=%22fake+news%22%7C%22false+news%22%7C%22false+stor*%22+%22accuracy%22%7C%22discernment%22%7C%22credibility%22%7C%22belief%22%7C%22suceptib*%22&hl=en&as_sdt=0,5&as_vis=1"
,76,"M Luo, JT Hancock, ...",Credibility perceptions and detection accuracy of fake news headlines on social media: Effects of truth-bias and endorsement cues,2022,Communication …,journals.sagepub.com,https://journals.sagepub.com/doi/pdf/10.1177/0093650220921321,"https://scholar.google.com/scholar?cites=17215003709517279767&as_sdt=2005&sciodt=0,5&hl=en",19,3/2/23 10:43,,10.1177/0093650220921321,,,,,,,76,76.00,25,3,1,"… user) of likes—on message credibility and detection accuracy. We evaluate how these cues might change credibility ratings and accuracy for real versus fake news on Facebook, the …",,"https://scholar.google.com/scholar?q=related:FzLPMKr65-4J:scholar.google.com/&scioq=%22fake+news%22%7C%22false+news%22%7C%22false+stor*%22+%22accuracy%22%7C%22discernment%22%7C%22credibility%22%7C%22belief%22%7C%22suceptib*%22&hl=en&as_sdt=0,5&as_vis=1"
,33,"MA Stefanone, M Vollmer, JM Covert",In news we trust? Examining credibility and sharing behaviors of fake news,2019,Proceedings of the 10th …,dl.acm.org,https://dl.acm.org/doi/abs/10.1145/3328529.3328554,"https://scholar.google.com/scholar?cites=17836380485956718540&as_sdt=2005&sciodt=0,5&hl=en",20,3/2/23 10:43,,10.1145/3328529.3328554,,,,,,,33,8.25,11,3,4,"… Therefore, our findings are limited to information processing of fake news on computers. Finally, a one item measure was used to assess perceptions of credibility. Additional items …",https://par.nsf.gov/servlets/purl/10121557,"https://scholar.google.com/scholar?q=related:zM8oAI2Nh_cJ:scholar.google.com/&scioq=%22fake+news%22%7C%22false+news%22%7C%22false+stor*%22+%22accuracy%22%7C%22discernment%22%7C%22credibility%22%7C%22belief%22%7C%22suceptib*%22&hl=en&as_sdt=0,5&as_vis=1"
,431,"G Pennycook, DG Rand",The psychology of fake news,2021,Trends in cognitive sciences,Elsevier,https://www.sciencedirect.com/science/article/pii/S1364661321000516,"https://scholar.google.com/scholar?cites=14396542033477471912&as_sdt=2005&sciodt=0,5&hl=en",21,3/2/23 10:43,HTML,,,,,,,,431,215.50,216,2,2,… (B) Difference in overall belief (average of belief in true news and belief in false news) between participants who scored higher on the Cognitive Reflection Test relative to those who …,https://www.sciencedirect.com/science/article/pii/S1364661321000516,"https://scholar.google.com/scholar?q=related:qI5nC7TKyscJ:scholar.google.com/&scioq=%22fake+news%22%7C%22false+news%22%7C%22false+stor*%22+%22accuracy%22%7C%22discernment%22%7C%22credibility%22%7C%22belief%22%7C%22suceptib*%22&hl=en&as_sdt=0,5&as_vis=1"
,175,"M Visentin, G Pizzi, M Pichierri","Fake news, real problems for brands: The impact of content truthfulness and source credibility on consumers' behavioral intentions toward the advertised brands",2019,Journal of Interactive …,journals.sagepub.com,https://journals.sagepub.com/doi/pdf/10.1016/j.intmar.2018.09.001,"https://scholar.google.com/scholar?cites=4653306930030974536&as_sdt=2005&sciodt=0,5&hl=en",22,3/2/23 10:43,,10.1016/j.intmar.2018.09.001,,,,,,,175,43.75,58,3,4,"… fake news on online advertising. Specifically, we explore a mediation chain that considers individuals' perceptions of news and source credibility… fake) and source credibility (ie, whether …",,"https://scholar.google.com/scholar?q=related:SBZco__dk0AJ:scholar.google.com/&scioq=%22fake+news%22%7C%22false+news%22%7C%22false+stor*%22+%22accuracy%22%7C%22discernment%22%7C%22credibility%22%7C%22belief%22%7C%22suceptib*%22&hl=en&as_sdt=0,5&as_vis=1"
,51,"S Kim, S Kim",The Crisis of public health and infodemic: Analyzing belief structure of fake news about COVID-19 pandemic,2020,Sustainability,mdpi.com,https://www.mdpi.com/903506,"https://scholar.google.com/scholar?cites=17158452360875188829&as_sdt=2005&sciodt=0,5&hl=en",23,3/2/23 10:43,,,,,,,,,51,17.00,26,2,3,"… finds that knowledge about fake news is positively related to belief in fake news. Moreover, the result shows that knowledge performs the function of further confirming fake news. In the …",https://www.mdpi.com/2071-1050/12/23/9904/pdf,"https://scholar.google.com/scholar?q=related:XaJtSYMRH-4J:scholar.google.com/&scioq=%22fake+news%22%7C%22false+news%22%7C%22false+stor*%22+%22accuracy%22%7C%22discernment%22%7C%22credibility%22%7C%22belief%22%7C%22suceptib*%22&hl=en&as_sdt=0,5&as_vis=1"
,1251,"G Pennycook, DG Rand","Lazy, not biased: Susceptibility to partisan fake news is better explained by lack of reasoning than by motivated reasoning",2019,Cognition,Elsevier,https://www.sciencedirect.com/science/article/pii/S001002771830163X,"https://scholar.google.com/scholar?cites=2481251703861696936&as_sdt=2005&sciodt=0,5&hl=en",24,3/2/23 10:43,,,,,,,,,1251,312.75,626,2,4,"… with the perceived accuracy of fake news, and positively correlated with the ability to discern … belief in fake news: A motivated reasoning account that suggests that belief in fake news is …",https://topicminer.hse.ru/rsf2019/literature/conspiracy-thinking/Pennycook%2520%25D0%25B8%2520Rand%2520-%25202019%2520-%2520Lazy%252C%2520not%2520biased%2520Susceptibility%2520to%2520partisan%2520fake%2520.pdf,"https://scholar.google.com/scholar?q=related:qFkCR0ctbyIJ:scholar.google.com/&scioq=%22fake+news%22%7C%22false+news%22%7C%22false+stor*%22+%22accuracy%22%7C%22discernment%22%7C%22credibility%22%7C%22belief%22%7C%22suceptib*%22&hl=en&as_sdt=0,5&as_vis=1"
,70,S Chambers,"Truth, deliberative democracy, and the virtues of accuracy: is fake news destroying the public sphere?",2021,Political Studies,journals.sagepub.com,https://journals.sagepub.com/doi/pdf/10.1177/0032321719890811,"https://scholar.google.com/scholar?cites=9527961254003746894&as_sdt=2005&sciodt=0,5&hl=en",25,3/2/23 10:43,PDF,10.1177/0032321719890811,,,,,,,70,35.00,70,1,2,"… fake news. The question I ask in this article is, do the epistemic uncertainties connected … fake news represent just another layer to our mediatized access to factual truth, or is fake news …",https://journals.sagepub.com/doi/pdf/10.1177/0032321719890811,"https://scholar.google.com/scholar?q=related:TiiUekceOoQJ:scholar.google.com/&scioq=%22fake+news%22%7C%22false+news%22%7C%22false+stor*%22+%22accuracy%22%7C%22discernment%22%7C%22credibility%22%7C%22belief%22%7C%22suceptib*%22&hl=en&as_sdt=0,5&as_vis=1"
,79,"D Halpern, S Valenzuela, J Katz, JP Miranda","From belief in conspiracy theories to trust in others: Which factors influence exposure, believing and sharing fake news",2019,"… 2019, Held as Part of the …",Springer,https://link.springer.com/chapter/10.1007/978-3-030-21902-4_16,"https://scholar.google.com/scholar?cites=6212525728496192672&as_sdt=2005&sciodt=0,5&hl=en",26,3/2/23 10:43,,10.1007/978-3-030-21902-4_16,,,,,,,79,19.75,20,4,4,"… to fake news” and “credibility in fake news.” We found three variables mediated by credibility in fake news… an effect in sharing fake news, but only through the credibility of fake news. So, …",https://www.researchgate.net/profile/Juan-Orrego-Miranda/publication/334352599_From_Belief_in_Conspiracy_Theories_to_Trust_in_Others_Which_Factors_Influence_Exposure_Believing_and_Sharing_Fake_News/links/5f6ba73e92851c14bc9228c5/From-Belief-in-Conspiracy-Theories-to-Trust-in-Others-Which-Factors-Influence-Exposure-Believing-and-Sharing-Fake-News.pdf,"https://scholar.google.com/scholar?q=related:oIz9FDxTN1YJ:scholar.google.com/&scioq=%22fake+news%22%7C%22false+news%22%7C%22false+stor*%22+%22accuracy%22%7C%22discernment%22%7C%22credibility%22%7C%22belief%22%7C%22suceptib*%22&hl=en&as_sdt=0,5&as_vis=1"
,384,"G Pennycook, A Bear, ET Collins, ...",The implied truth effect: Attaching warnings to a subset of fake news headlines increases perceived accuracy of headlines without warnings,2020,Management …,pubsonline.informs.org,https://pubsonline.informs.org/doi/abs/10.1287/mnsc.2019.3478,"https://scholar.google.com/scholar?cites=10497974027071705931&as_sdt=2005&sciodt=0,5&hl=en",27,3/2/23 10:43,,10.1287/mnsc.2019.3478,,,,,,,384,128.00,96,4,3,… warning tags will effectively reduce belief in false news. … We begin by introducing a Bayesian model of belief updating in … rated the accuracy of a series of true and false (fake news) …,https://pubsonline.informs.org/doi/pdf/10.1287/mnsc.2019.3478,"https://scholar.google.com/scholar?q=related:S9PiyMFLsJEJ:scholar.google.com/&scioq=%22fake+news%22%7C%22false+news%22%7C%22false+stor*%22+%22accuracy%22%7C%22discernment%22%7C%22credibility%22%7C%22belief%22%7C%22suceptib*%22&hl=en&as_sdt=0,5&as_vis=1"
