screening,Cites,Authors,Title,Year,Source,Publisher,ArticleURL,CitesURL,GSRank,QueryDate,Type,DOI,ISSN,CitationURL,Volume,Issue,StartPage,EndPage,ECC,CitesPerYear,CitesPerAuthor,AuthorCount,Age,Abstract,FullTextURL,RelatedURL
,679,A Gelfert,Fake news: A definition,2018,Informal logic,erudit.org,https://www.erudit.org/en/journals/informallogic/1900-v1-n1-informallogic04379/1057034ar/abstract/,"https://scholar.google.com/scholar?cites=2791105368378753539&as_sdt=2005&sciodt=0,5&hl=en",229,3/2/23 10:43,,,,,,,,,679,135.80,679,1,5,… media have enabled purveyors of fake news to target specific … consumers into propagating fake news claims even further. … : much of the initial credibility of fake news derives from real…,https://www.erudit.org/en/journals/informallogic/1900-v1-n1-informallogic04379/1057034ar.pdf,"https://scholar.google.com/scholar?q=related:A8LmbIv_uyYJ:scholar.google.com/&scioq=%22fake+news%22%7C%22false+news%22%7C%22false+stor*%22+%22accuracy%22%7C%22discernment%22%7C%22credibility%22%7C%22belief%22%7C%22suceptib*%22&hl=en&as_sdt=0,5&as_vis=1"
,29,"E Qawasmeh, M Tawalbeh, ...",Automatic identification of fake news using deep learning,2019,2019 Sixth international …,ieeexplore.ieee.org,https://ieeexplore.ieee.org/abstract/document/8931873/,"https://scholar.google.com/scholar?cites=13220500430259320929&as_sdt=2005&sciodt=0,5&hl=en",230,3/2/23 10:43,,,,,,,,,29,7.25,10,3,4,"… Their experiments showed that the social network features, such as structure and propagation, achieved high accuracy (92.7 % ROC AUC) on fake news detection model. …",https://www.researchgate.net/profile/Mais-Tawalbeh/publication/337985584_Automatic_Identification_of_Fake_News_Using_Deep_Learning/links/5dfd66ce4585159aa48d2431/Automatic-Identification-of-Fake-News-Using-Deep-Learning.pdf,"https://scholar.google.com/scholar?q=related:YXiBmhineLcJ:scholar.google.com/&scioq=%22fake+news%22%7C%22false+news%22%7C%22false+stor*%22+%22accuracy%22%7C%22discernment%22%7C%22credibility%22%7C%22belief%22%7C%22suceptib*%22&hl=en&as_sdt=0,5&as_vis=1"
,39,"N Smitha, R Bharath",Performance comparison of machine learning classifiers for fake news detection,2020,2020 Second International Conference …,ieeexplore.ieee.org,https://ieeexplore.ieee.org/abstract/document/9183072/,"https://scholar.google.com/scholar?cites=15456739236458549924&as_sdt=2005&sciodt=0,5&hl=en",231,3/2/23 10:43,,,,,,,,,39,13.00,20,2,3,"… This paper illustrates model and methodology to detect fake news from news article with the … as fake or real and are compared considering accuracy, F1 Score, recall, precision and best …",https://www.researchgate.net/profile/Smitha-Nl/publication/344050009_Performance_Comparison_of_Machine_Learning_Classifiers_for_Fake_News_Detection/links/608107788ea909241e16da7f/Performance-Comparison-of-Machine-Learning-Classifiers-for-Fake-News-Detection.pdf,"https://scholar.google.com/scholar?q=related:pFL0NnFegdYJ:scholar.google.com/&scioq=%22fake+news%22%7C%22false+news%22%7C%22false+stor*%22+%22accuracy%22%7C%22discernment%22%7C%22credibility%22%7C%22belief%22%7C%22suceptib*%22&hl=en&as_sdt=0,5&as_vis=1"
,1444,"G Pennycook, J McPhetres, Y Zhang, ...",Fighting COVID-19 misinformation on social media: Experimental evidence for a scalable accuracy-nudge intervention,2020,Psychological …,journals.sagepub.com,https://journals.sagepub.com/doi/pdf/10.1177/0956797620939054,"https://scholar.google.com/scholar?cites=18245661422465333264&as_sdt=2005&sciodt=0,5&hl=en",232,3/2/23 10:43,PDF,10.1177/0956797620939054,,,,,,,1444,481.33,361,4,3,"… of a nonCOVID-19-related headline) nearly tripled the level of truth discernment in … previously for political fake news, suggest that nudging people to think about accuracy is a simple way …",https://journals.sagepub.com/doi/pdf/10.1177/0956797620939054,"https://scholar.google.com/scholar?q=related:EDgY4mScNf0J:scholar.google.com/&scioq=%22fake+news%22%7C%22false+news%22%7C%22false+stor*%22+%22accuracy%22%7C%22discernment%22%7C%22credibility%22%7C%22belief%22%7C%22suceptib*%22&hl=en&as_sdt=0,5&as_vis=1"
,17,"P Shah, Z Kobti",Multimodal fake news detection using a Cultural Algorithm with situational and normative knowledge,2020,2020 IEEE congress on evolutionary …,ieeexplore.ieee.org,https://ieeexplore.ieee.org/abstract/document/9185643/,"https://scholar.google.com/scholar?cites=13452371369407640830&as_sdt=2005&sciodt=0,5&hl=en",233,3/2/23 10:43,,,,,,,,,17,5.67,9,2,3,"… state-of-the-art methods for identifying fake news in terms of accuracy by 9% on average. … well in identifying fake news, consideration of secondary task with fake news detection problem …",https://scholar.uwindsor.ca/cgi/viewcontent.cgi?article=9401&context=etd,"https://scholar.google.com/scholar?q=related:_nQtnHxssLoJ:scholar.google.com/&scioq=%22fake+news%22%7C%22false+news%22%7C%22false+stor*%22+%22accuracy%22%7C%22discernment%22%7C%22credibility%22%7C%22belief%22%7C%22suceptib*%22&hl=en&as_sdt=0,5&as_vis=1"
,78,"Y Liu, YFB Wu",Fned: a deep network for fake news early detection on social media,2020,ACM Transactions on Information Systems (TOIS),dl.acm.org,https://dl.acm.org/doi/abs/10.1145/3386253,"https://scholar.google.com/scholar?cites=12096622598865664925&as_sdt=2005&sciodt=0,5&hl=en",234,3/2/23 10:43,,10.1145/3386253,,,,,,,78,26.00,39,2,3,"… fake news. In this article, we propose a novel deep neural network to detect fake news early. … our proposed model can detect fake news with greater than 90% accuracy within 5 minutes …",,"https://scholar.google.com/scholar?q=related:nbtZuynW36cJ:scholar.google.com/&scioq=%22fake+news%22%7C%22false+news%22%7C%22false+stor*%22+%22accuracy%22%7C%22discernment%22%7C%22credibility%22%7C%22belief%22%7C%22suceptib*%22&hl=en&as_sdt=0,5&as_vis=1"
,250,"R Oshikawa, J Qian, WY Wang",A survey on natural language processing for fake news detection,2018,arXiv preprint arXiv:1811.00770,arxiv.org,https://arxiv.org/abs/1811.00770,"https://scholar.google.com/scholar?cites=14494158380776624759&as_sdt=2005&sciodt=0,5&hl=en",235,3/2/23 10:43,,,,,,,,,250,50.00,83,3,5,"… have been improved, we already achieve high accuracy on binary classification, especially on claims. In Table 5 and the bottom 2 case in Table 3, the accuracy of 2-class prediction is …",https://arxiv.org/pdf/1811.00770,"https://scholar.google.com/scholar?q=related:dxJxBEGYJckJ:scholar.google.com/&scioq=%22fake+news%22%7C%22false+news%22%7C%22false+stor*%22+%22accuracy%22%7C%22discernment%22%7C%22credibility%22%7C%22belief%22%7C%22suceptib*%22&hl=en&as_sdt=0,5&as_vis=1"
,47,A Wenzel,To verify or to disengage: Coping with “fake news” and ambiguity,2019,International Journal of Communication,ijoc.org,https://ijoc.org/index.php/ijoc/article/view/10025,"https://scholar.google.com/scholar?cites=2742197185250311478&as_sdt=2005&sciodt=0,5&hl=en",236,3/2/23 10:43,,,,,,,,,47,11.75,47,1,4,"… Despite variations in definition, for many groups, the concept of fake news was put forward to raise questions not only about the credibility of news found on social media, but also …",https://ijoc.org/index.php/ijoc/article/download/10025/2636,"https://scholar.google.com/scholar?q=related:Nr3rqs89DiYJ:scholar.google.com/&scioq=%22fake+news%22%7C%22false+news%22%7C%22false+stor*%22+%22accuracy%22%7C%22discernment%22%7C%22credibility%22%7C%22belief%22%7C%22suceptib*%22&hl=en&as_sdt=0,5&as_vis=1"
,11,"V Sabeeh, M Zohdy, A Mollah, ...",Fake news detection on social media using deep learning and semantic knowledge sources,2020,International Journal of …,academia.edu,https://www.academia.edu/download/63510159/05_Paper_01022015_IJCSIS_Camera_Ready_pp45-6820200602-109747-dpv8ec.pdf,"https://scholar.google.com/scholar?cites=6104812955460165532&as_sdt=2005&sciodt=0,5&hl=en",237,3/2/23 10:43,PDF,,,,,,,,11,3.67,3,4,3,"… referred to as detecting fake news on Social media Platforms … on user comment, and credibility analysis of Twitter metadata. … a credibility score to provide efficient decisions for fake news …",https://www.academia.edu/download/63510159/05_Paper_01022015_IJCSIS_Camera_Ready_pp45-6820200602-109747-dpv8ec.pdf,"https://scholar.google.com/scholar?q=related:nN9nzgmnuFQJ:scholar.google.com/&scioq=%22fake+news%22%7C%22false+news%22%7C%22false+stor*%22+%22accuracy%22%7C%22discernment%22%7C%22credibility%22%7C%22belief%22%7C%22suceptib*%22&hl=en&as_sdt=0,5&as_vis=1"
,14,"A Baruah, KA Das, FA Barbhuiya, K Dey",Automatic Detection of Fake News Spreaders Using BERT.,2020,CLEF (Working Notes),ceur-ws.org,http://ceur-ws.org/Vol-2696/paper_237.pdf,"https://scholar.google.com/scholar?cites=2531834825456091674&as_sdt=2005&sciodt=0,5&hl=en",238,3/2/23 10:43,PDF,,,,,,,,14,4.67,4,4,3,"… Our model obtained accuracy score of 0.6900 in the test data. It performed better than the character n-gram based SVM, LSTM, emotionally infused LSTM and the random baseline …",http://ceur-ws.org/Vol-2696/paper_237.pdf,"https://scholar.google.com/scholar?q=related:GgJGCVziIiMJ:scholar.google.com/&scioq=%22fake+news%22%7C%22false+news%22%7C%22false+stor*%22+%22accuracy%22%7C%22discernment%22%7C%22credibility%22%7C%22belief%22%7C%22suceptib*%22&hl=en&as_sdt=0,5&as_vis=1"
,18,"I Kareem, SM Awan",Pakistani media fake news classification using machine learning classifiers,2019,2019 International Conference on …,ieeexplore.ieee.org,https://ieeexplore.ieee.org/abstract/document/8966734/,"https://scholar.google.com/scholar?cites=6005144960198877381&as_sdt=2005&sciodt=0,5&hl=en",239,3/2/23 10:43,,,,,,,,,18,4.50,9,2,4,"… The classification accuracy on the test data set using naive Bayes is 74%. This study shows fake news classification had made with simple artificial intelligence method [11]. Conroy, …",,"https://scholar.google.com/scholar?q=related:xaBhUYaPVlMJ:scholar.google.com/&scioq=%22fake+news%22%7C%22false+news%22%7C%22false+stor*%22+%22accuracy%22%7C%22discernment%22%7C%22credibility%22%7C%22belief%22%7C%22suceptib*%22&hl=en&as_sdt=0,5&as_vis=1"
,15,"P Bhattacharya, SB Patel, R Gupta, ...",SaTYa: Trusted Bi-LSTM-Based fake news classification scheme for smart community,2021,IEEE Transactions …,ieeexplore.ieee.org,https://ieeexplore.ieee.org/abstract/document/9646438/,"https://scholar.google.com/scholar?cites=3503860322978377935&as_sdt=2005&sciodt=0,5&hl=en",240,3/2/23 10:43,,,,,,,,,15,7.50,4,4,2,"… fake news, we require a trust-based DLT mechanism that can chronologically trace the fake news generation to curtail further fake news … details of the training accuracy of our proposed …",https://nirmawebsite.s3.ap-south-1.amazonaws.com/wp-content/uploads/sites/22/2022/03/satya.pdf,"https://scholar.google.com/scholar?q=related:zzC2RWY2oDAJ:scholar.google.com/&scioq=%22fake+news%22%7C%22false+news%22%7C%22false+stor*%22+%22accuracy%22%7C%22discernment%22%7C%22credibility%22%7C%22belief%22%7C%22suceptib*%22&hl=en&as_sdt=0,5&as_vis=1"
,54,"J Andersen, SO Søe","Communicative actions we live by: The problem with fact-checking, tagging or flagging fake news–the case of Facebook",2020,European Journal of Communication,journals.sagepub.com,https://journals.sagepub.com/doi/pdf/10.1177/0267323119894489,"https://scholar.google.com/scholar?cites=16317153214613840650&as_sdt=2005&sciodt=0,5&hl=en",241,3/2/23 10:43,,10.1177/0267323119894489,,,,,,,54,18.00,27,2,3,"… or appearances of fake news. We argue that in a global world of communication, fake news is a … The very existence of fake news is a political question inscribing itself in the history of …",https://core.ac.uk/download/pdf/323514643.pdf,"https://scholar.google.com/scholar?q=related:CmOujmUscuIJ:scholar.google.com/&scioq=%22fake+news%22%7C%22false+news%22%7C%22false+stor*%22+%22accuracy%22%7C%22discernment%22%7C%22credibility%22%7C%22belief%22%7C%22suceptib*%22&hl=en&as_sdt=0,5&as_vis=1"
,28,I Vamanu,Fake news and propaganda: A critical discourse research perspective,2019,Open Information Science,degruyter.com,https://www.degruyter.com/document/doi/10.1515/opis-2019-0014/html,"https://scholar.google.com/scholar?cites=11753266086855716167&as_sdt=2005&sciodt=0,5&hl=en",242,3/2/23 10:43,,10.1515/opis-2019-0014,,,,,,,28,7.00,28,1,4,"… of a post-truth climate in our societies, where “belief no longer has to follow fact” (Bermúdez, 2018… with the spread of fake news (eg, Fallis, 2004; Legg, 2018). Fake news is also a salient …",https://www.degruyter.com/document/doi/10.1515/opis-2019-0014/pdf,"https://scholar.google.com/scholar?q=related:Ry2uCTz9G6MJ:scholar.google.com/&scioq=%22fake+news%22%7C%22false+news%22%7C%22false+stor*%22+%22accuracy%22%7C%22discernment%22%7C%22credibility%22%7C%22belief%22%7C%22suceptib*%22&hl=en&as_sdt=0,5&as_vis=1"
,74,"A Jain, A Shakya, H Khatter, ...",A smart system for fake news detection using machine learning,2019,… conference on issues …,ieeexplore.ieee.org,https://ieeexplore.ieee.org/abstract/document/8977659/,"https://scholar.google.com/scholar?cites=8267856073393490021&as_sdt=2005&sciodt=0,5&hl=en",243,3/2/23 10:43,,,,,,,,,74,18.50,19,4,4,… the fake news after massive widespread fake news in recent times. There are three types of fake news … CONCLUSION It is significant to find the accuracy of news which is available on …,https://www.researchgate.net/profile/Harsh-Khatter/publication/339022255_A_smart_System_for_Fake_News_Detection_Using_Machine_Learning/links/5f9112b0299bf1b53e3a2aa1/A-smart-System-for-Fake-News-Detection-Using-Machine-Learning.pdf,"https://scholar.google.com/scholar?q=related:ZcisNEtTvXIJ:scholar.google.com/&scioq=%22fake+news%22%7C%22false+news%22%7C%22false+stor*%22+%22accuracy%22%7C%22discernment%22%7C%22credibility%22%7C%22belief%22%7C%22suceptib*%22&hl=en&as_sdt=0,5&as_vis=1"
,75,"L Ha, L Andreu Perez, R Ray","Mapping recent development in scholarship on fake news and misinformation, 2008 to 2017: Disciplinary contribution, topics, and impact",2021,American behavioral scientist,journals.sagepub.com,https://journals.sagepub.com/doi/pdf/10.1177/0002764219869402,"https://scholar.google.com/scholar?cites=13119037183778314245&as_sdt=2005&sciodt=0,5&hl=en",244,3/2/23 10:43,,10.1177/0002764219869402,,,,,,,75,37.50,25,3,2,… This review article examines 142 journal articles on fake news and misinformation published … fake news because sharing increases the reach and apparent credibility of the fake news. …,,"https://scholar.google.com/scholar?q=related:BVg_ns8uELYJ:scholar.google.com/&scioq=%22fake+news%22%7C%22false+news%22%7C%22false+stor*%22+%22accuracy%22%7C%22discernment%22%7C%22credibility%22%7C%22belief%22%7C%22suceptib*%22&hl=en&as_sdt=0,5&as_vis=1"
,14,"SB Majumder, D Das",Detecting Fake News Spreaders on Twitter Using Universal Sentence Encoder.,2020,CLEF (Working Notes),ceur-ws.org,http://ceur-ws.org/Vol-2696/paper_118.pdf,"https://scholar.google.com/scholar?cites=10528737958427294725&as_sdt=2005&sciodt=0,5&hl=en",245,3/2/23 10:43,PDF,,,,,,,,14,4.67,7,2,3,"… 72% accuracy in this fake news spreader … Fake news detection is becoming one of the challenging tasks of recent years. However, in this present task, instead of detecting fake news, …",http://ceur-ws.org/Vol-2696/paper_118.pdf,"https://scholar.google.com/scholar?q=related:Bfw6uWOXHZIJ:scholar.google.com/&scioq=%22fake+news%22%7C%22false+news%22%7C%22false+stor*%22+%22accuracy%22%7C%22discernment%22%7C%22credibility%22%7C%22belief%22%7C%22suceptib*%22&hl=en&as_sdt=0,5&as_vis=1"
,379,"A Bondielli, F Marcelloni",A survey on fake news and rumour detection techniques,2019,Information Sciences,Elsevier,https://www.sciencedirect.com/science/article/pii/S0020025519304372,"https://scholar.google.com/scholar?cites=17724437646965414560&as_sdt=2005&sciodt=0,5&hl=en",246,3/2/23 10:43,,,,,,,,,379,94.75,190,2,4,"… detection of fake news and … of fake news and rumours that have been considered in the literature. Second, we highlight how the collection of relevant data for performing fake news and …",https://arpi.unipi.it/bitstream/11568/1000990/5/FakeNewsRumoursSurvey.pdf,"https://scholar.google.com/scholar?q=related:oBrvviHa-fUJ:scholar.google.com/&scioq=%22fake+news%22%7C%22false+news%22%7C%22false+stor*%22+%22accuracy%22%7C%22discernment%22%7C%22credibility%22%7C%22belief%22%7C%22suceptib*%22&hl=en&as_sdt=0,5&as_vis=1"
,176,"K Shu, S Wang, H Liu",Exploiting tri-relationship for fake news detection,2017,arXiv preprint arXiv:1712.07709,researchgate.net,https://www.researchgate.net/profile/Kai-Shu/publication/321994372_Exploiting_Tri-Relationship_for_Fake_News_Detection/links/5a40387aaca272d2945274b3/Exploiting-Tri-Relationship-for-Fake-News-Detection.pdf,"https://scholar.google.com/scholar?cites=13343522992046532658&as_sdt=2005&sciodt=0,5&hl=en",247,3/2/23 10:43,PDF,,,,,,,,176,29.33,59,3,6,… Fake News detection framework (TriFN). We also provide two comprehensive real-world fake news datasets to facilitate fake news … low-credibility users are close to the fake news latent …,https://www.researchgate.net/profile/Kai-Shu/publication/321994372_Exploiting_Tri-Relationship_for_Fake_News_Detection/links/5a40387aaca272d2945274b3/Exploiting-Tri-Relationship-for-Fake-News-Detection.pdf,"https://scholar.google.com/scholar?q=related:Mugw2Xa3LbkJ:scholar.google.com/&scioq=%22fake+news%22%7C%22false+news%22%7C%22false+stor*%22+%22accuracy%22%7C%22discernment%22%7C%22credibility%22%7C%22belief%22%7C%22suceptib*%22&hl=en&as_sdt=0,5&as_vis=1"
,154,"K Shu, HR Bernard, H Liu",Studying fake news via network analysis: detection and mitigation,2019,… in computational social network analysis and …,Springer,https://link.springer.com/chapter/10.1007/978-3-319-94105-9_3,"https://scholar.google.com/scholar?cites=11907366702055405155&as_sdt=2005&sciodt=0,5&hl=en",248,3/2/23 10:43,,10.1007/978-3-319-94105-9_3,,,,,,,154,38.50,51,3,4,"… Intuitively, users with low credibilities are more likely to spread fake news, while users with high-credibility scores are less likely to spread fake news. Each user has a credibility score …",https://arxiv.org/pdf/1804.10233,"https://scholar.google.com/scholar?q=related:Y7ZTdu12P6UJ:scholar.google.com/&scioq=%22fake+news%22%7C%22false+news%22%7C%22false+stor*%22+%22accuracy%22%7C%22discernment%22%7C%22credibility%22%7C%22belief%22%7C%22suceptib*%22&hl=en&as_sdt=0,5&as_vis=1"
,19,A Koirala,COVID-19 fake news classification with deep learning,2020,Preprint,researchgate.net,https://www.researchgate.net/profile/Abhishek-Koirala/publication/344966237_COVID-19_Fake_News_Classification_with_Deep_Learning/links/5f9b6ba5299bf1b53e5130b8/COVID-19-Fake-News-Classification-with-Deep-Learning.pdf,"https://scholar.google.com/scholar?cites=16064076191358727017&as_sdt=2005&sciodt=0,5&hl=en",249,3/2/23 10:43,PDF,,,,,,,,19,6.33,19,1,3,"… of fake news. Among the research done, the accuracy achieved is not so high. This paper discusses such classification of fake news articles related to COVID-19 using deep learning. …",https://www.researchgate.net/profile/Abhishek-Koirala/publication/344966237_COVID-19_Fake_News_Classification_with_Deep_Learning/links/5f9b6ba5299bf1b53e5130b8/COVID-19-Fake-News-Classification-with-Deep-Learning.pdf,"https://scholar.google.com/scholar?q=related:aTO_Vi8Q794J:scholar.google.com/&scioq=%22fake+news%22%7C%22false+news%22%7C%22false+stor*%22+%22accuracy%22%7C%22discernment%22%7C%22credibility%22%7C%22belief%22%7C%22suceptib*%22&hl=en&as_sdt=0,5&as_vis=1"
,13,"A Abdulrahman, M Baykara",Fake news detection using machine learning and deep learning algorithms,2020,2020 International Conference on …,ieeexplore.ieee.org,https://ieeexplore.ieee.org/abstract/document/9436605/,"https://scholar.google.com/scholar?cites=13086269468096374268&as_sdt=2005&sciodt=0,5&hl=en",250,3/2/23 10:43,,,,,,,,,13,4.33,7,2,3,… interest in fake news and its identification by researchers. This study focused on classifying fake news on … This study obtained an accuracy range of 81 to 100% using different classifiers. …,https://www.researchgate.net/profile/Awf-Abd/publication/352021652_Fake_News_Detection_Using_Machine_Learning_and_Deep_Learning_Algorithms/links/631b499c071ea12e361ef6c7/Fake-News-Detection-Using-Machine-Learning-and-Deep-Learning-Algorithms.pdf,"https://scholar.google.com/scholar?q=related:_KXsSL_Em7UJ:scholar.google.com/&scioq=%22fake+news%22%7C%22false+news%22%7C%22false+stor*%22+%22accuracy%22%7C%22discernment%22%7C%22credibility%22%7C%22belief%22%7C%22suceptib*%22&hl=en&as_sdt=0,5&as_vis=1"
,10,"H Saadany, E Mohamed, C Orasan",Fake or real? A study of Arabic satirical fake news,2020,arXiv preprint arXiv:2011.00452,arxiv.org,https://arxiv.org/abs/2011.00452,"https://scholar.google.com/scholar?cites=3640280630416065792&as_sdt=2005&sciodt=0,5&hl=en",251,3/2/23 10:43,,,,,,,,,10,3.33,3,3,3,… We exploit these features to build a number of machine learning models capable of identifying satirical fake news with an accuracy of up to 98.6%. The study introduces a new dataset (…,https://arxiv.org/pdf/2011.00452,"https://scholar.google.com/scholar?q=related:AEWvQvLfhDIJ:scholar.google.com/&scioq=%22fake+news%22%7C%22false+news%22%7C%22false+stor*%22+%22accuracy%22%7C%22discernment%22%7C%22credibility%22%7C%22belief%22%7C%22suceptib*%22&hl=en&as_sdt=0,5&as_vis=1"
,15,"D Mangal, DK Sharma",Fake news detection with integration of embedded text cues and image features,2020,2020 8th international conference on …,ieeexplore.ieee.org,https://ieeexplore.ieee.org/abstract/document/9197817/,"https://scholar.google.com/scholar?cites=10973334200428278777&as_sdt=2005&sciodt=0,5&hl=en",252,3/2/23 10:43,,,,,,,,,15,5.00,8,2,3,"… In this research paper, It states that we achieve accuracy of 91.07% in detection of fake news. First time visual features and embedded text features on image has been involved to get …",,"https://scholar.google.com/scholar?q=related:-TMs6lAdSZgJ:scholar.google.com/&scioq=%22fake+news%22%7C%22false+news%22%7C%22false+stor*%22+%22accuracy%22%7C%22discernment%22%7C%22credibility%22%7C%22belief%22%7C%22suceptib*%22&hl=en&as_sdt=0,5&as_vis=1"
,192,"I Ahmad, M Yousaf, S Yousaf, MO Ahmad",Fake news detection using machine learning ensemble methods,2020,Complexity,hindawi.com,https://www.hindawi.com/journals/complexity/2020/8885861/,"https://scholar.google.com/scholar?cites=7097190165451879791&as_sdt=2005&sciodt=0,5&hl=en",253,3/2/23 10:43,HTML,,,,,,,,192,64.00,48,4,3,… Table 2 summarizes the accuracy achieved by each algorithm on the four considered datasets. It is evident that the maximum accuracy achieved on DS1 (ISOT Fake News Dataset) is 99…,https://www.hindawi.com/journals/complexity/2020/8885861/,"https://scholar.google.com/scholar?q=related:b7UnW9pIfmIJ:scholar.google.com/&scioq=%22fake+news%22%7C%22false+news%22%7C%22false+stor*%22+%22accuracy%22%7C%22discernment%22%7C%22credibility%22%7C%22belief%22%7C%22suceptib*%22&hl=en&as_sdt=0,5&as_vis=1"
,117,L Fazio,Pausing to consider why a headline is true or false can help reduce the sharing of false news,2020,Harvard Kennedy School Misinformation …,misinforeview.hks.harvard.edu,https://misinforeview.hks.harvard.edu/article/pausing-reduce-false-news/,"https://scholar.google.com/scholar?cites=2320662766288506646&as_sdt=2005&sciodt=0,5&hl=en",254,3/2/23 10:43,HTML,,,,,,,,117,39.00,117,1,3,"… We suggest that social media companies should implement these pauses and encourage people to consider the accuracy and quality of what they are posting. For example, Instagram …",https://misinforeview.hks.harvard.edu/article/pausing-reduce-false-news/,"https://scholar.google.com/scholar?q=related:Fg8alH2mNCAJ:scholar.google.com/&scioq=%22fake+news%22%7C%22false+news%22%7C%22false+stor*%22+%22accuracy%22%7C%22discernment%22%7C%22credibility%22%7C%22belief%22%7C%22suceptib*%22&hl=en&as_sdt=0,5&as_vis=1"
,73,"M Zimdars, K McLeod",Fake news: understanding media and misinformation in the digital age,2020,,books.google.com,https://books.google.com/books?hl=en&lr=&id=1WPMDwAAQBAJ&oi=fnd&pg=PR5&dq=%22fake+news%22%7C%22false+news%22%7C%22false+stor*%22+%22accuracy%22%7C%22discernment%22%7C%22credibility%22%7C%22belief%22%7C%22suceptib*%22&ots=TMKwEJYFJR&sig=5WLfroCj_6-qNCW1jqBRZLUmGJ0,"https://scholar.google.com/scholar?cites=9109505045941181435&as_sdt=2005&sciodt=0,5&hl=en",255,3/2/23 10:43,BOOK,,,,,,,,73,24.33,37,2,3,"… that is the production and circulation of fake news. What is fake news? Is it an item on … This book examines the real fake news: the constant flow of purposefully crafted, sensational…",,"https://scholar.google.com/scholar?q=related:-9vzNpN2a34J:scholar.google.com/&scioq=%22fake+news%22%7C%22false+news%22%7C%22false+stor*%22+%22accuracy%22%7C%22discernment%22%7C%22credibility%22%7C%22belief%22%7C%22suceptib*%22&hl=en&as_sdt=0,5&as_vis=1"
,33,T Mould,Introduction to the special issue on fake news: Definitions and approaches,2018,Journal of American Folklore,scholarlypublishingcollective.org,https://scholarlypublishingcollective.org/uip/jaf/article-abstract/131/522/371/227089,"https://scholar.google.com/scholar?cites=14469403538338352888&as_sdt=2005&sciodt=0,5&hl=en",256,3/2/23 10:43,,,,,,,,,33,6.60,33,1,5,"… Folklorists are not only well positioned to study fake news because it so often parallels or is transformed into traditional forms, but also because of our (1) recognition that truth and belief …",,"https://scholar.google.com/scholar?q=related:-A5wHtulzcgJ:scholar.google.com/&scioq=%22fake+news%22%7C%22false+news%22%7C%22false+stor*%22+%22accuracy%22%7C%22discernment%22%7C%22credibility%22%7C%22belief%22%7C%22suceptib*%22&hl=en&as_sdt=0,5&as_vis=1"
