screening,Cites,Authors,Title,Year,Source,Publisher,ArticleURL,CitesURL,GSRank,QueryDate,Type,DOI,ISSN,CitationURL,Volume,Issue,StartPage,EndPage,ECC,CitesPerYear,CitesPerAuthor,AuthorCount,Age,Abstract,FullTextURL,RelatedURL
,24,"A Flostrand, L Pitt, J Kietzmann","Fake news and brand management: a Delphi study of impact, vulnerability and mitigation",2020,Journal of product &brand …,emerald.com,https://www.emerald.com/insight/content/doi/10.1108/JPBM-12-2018-2156/full/html,"https://scholar.google.com/scholar?cites=10683907560178166253&as_sdt=2005&sciodt=0,5&hl=en",739,3/2/23 10:43,,10.1108/JPBM-12-2018-2156,,,,,,,24,8.00,8,3,3,"… that provides credibility to fake news, especially in the case of fake news appearing on … to a fake news headline on Facebook increases subsequent belief in its accuracy by viewers (eg “…",https://www.researchgate.net/profile/Jan-Kietzmann/publication/335612473_Fake_news_and_brand_management_a_Delphi_study_of_impact_vulnerability_and_mitigation/links/5e158fc8a6fdcc283761bc07/Fake-news-and-brand-management-a-Delphi-study-of-impact-vulnerability-and-mitigation.pdf,"https://scholar.google.com/scholar?q=related:7amH-VHdRJQJ:scholar.google.com/&scioq=%22fake+news%22%7C%22false+news%22%7C%22false+stor*%22+%22accuracy%22%7C%22discernment%22%7C%22credibility%22%7C%22belief%22%7C%22suceptib*%22&hl=en&as_sdt=0,5&as_vis=1"
,555,"VL Rubin, N Conroy, Y Chen, ...",Fake news or truth? using satirical cues to detect potentially misleading news,2016,Proceedings of the …,aclanthology.org,https://aclanthology.org/W16-0802.pdf,"https://scholar.google.com/scholar?cites=3149541430832693095&as_sdt=2005&sciodt=0,5&hl=en",740,3/2/23 10:43,PDF,,,,,,,,555,79.29,139,4,7,"… news can intentionally create a false belief in the readers’ … detection that reaches relatively high accuracy rates (90% … Practically, this study frames fake news as a worthy target for fil…",https://aclanthology.org/W16-0802.pdf,"https://scholar.google.com/scholar?q=related:Z38ojj5rtSsJ:scholar.google.com/&scioq=%22fake+news%22%7C%22false+news%22%7C%22false+stor*%22+%22accuracy%22%7C%22discernment%22%7C%22credibility%22%7C%22belief%22%7C%22suceptib*%22&hl=en&as_sdt=0,5&as_vis=1"
,16,"M Choraś, A Giełczyk, K Demestichas, ...",Pattern recognition solutions for fake news detection,2018,… Information Systems and …,Springer,https://link.springer.com/chapter/10.1007/978-3-319-99954-8_12,"https://scholar.google.com/scholar?cites=2747299082502072793&as_sdt=2005&sciodt=0,5&hl=en",741,3/2/23 10:43,,10.1007/978-3-319-99954-8_12,,,,,,,16,3.20,4,4,5,"… of these fake news types requires individual methods for the assessment of their credibility. For … One of examples of automated detection of fake news is so called CSI model [9], where …",https://www.researchgate.net/profile/Konstantinos-Demestichas-2/publication/327433553_Pattern_Recognition_Solutions_for_Fake_News_Detection_17th_International_Conference_CISIM_2018_Olomouc_Czech_Republic_September_27-29_2018_Proceedings/links/5f63238e92851c14bc818af2/Pattern-Recognition-Solutions-for-Fake-News-Detection-17th-International-Conference-CISIM-2018-Olomouc-Czech-Republic-September-27-29-2018-Proceedings.pdf,"https://scholar.google.com/scholar?q=related:2elKsPVdICYJ:scholar.google.com/&scioq=%22fake+news%22%7C%22false+news%22%7C%22false+stor*%22+%22accuracy%22%7C%22discernment%22%7C%22credibility%22%7C%22belief%22%7C%22suceptib*%22&hl=en&as_sdt=0,5&as_vis=1"
,21,"R Scardigno, G Mininni",The rhetoric side of fake news: a new weapon for anti-politics?,2020,World Futures,Taylor &Francis,https://www.tandfonline.com/doi/abs/10.1080/02604027.2019.1703158,"https://scholar.google.com/scholar?cites=9755074104584613714&as_sdt=2005&sciodt=0,5&hl=en",742,3/2/23 10:43,,10.1080/02604027.2019.1703158,,,,,,,21,7.00,11,2,3,"… As an “insidious form of post-truth rhetoric”, fake news find a … and rhetoric facets of fake news has been rather neglected. … Through the discourse analysis applied to several fake news …",https://www.researchgate.net/profile/Rosa-Scardigno/publication/338293047_The_Rhetoric_Side_of_Fake_News_A_New_Weapon_for_Anti-Politics/links/5e14a162299bf10bc397df33/The-Rhetoric-Side-of-Fake-News-A-New-Weapon-for-Anti-Politics.pdf?_sg%5B0%5D=started_experiment_milestone&origin=journalDetail,"https://scholar.google.com/scholar?q=related:Uq9gqTb8YIcJ:scholar.google.com/&scioq=%22fake+news%22%7C%22false+news%22%7C%22false+stor*%22+%22accuracy%22%7C%22discernment%22%7C%22credibility%22%7C%22belief%22%7C%22suceptib*%22&hl=en&as_sdt=0,5&as_vis=1"
,31,"AC Brisola, A Doyle",Critical information literacy as a path to resist “fake news”: Understanding disinformation as the root problem,2019,Open Information Science,degruyter.com,https://www.degruyter.com/document/doi/10.1515/opis-2019-0019/html,"https://scholar.google.com/scholar?cites=10193772980687037504&as_sdt=2005&sciodt=0,5&hl=en",743,3/2/23 10:43,,10.1515/opis-2019-0019,,,,,,,31,7.75,16,2,4,"… for Fake News, because those who produce them do not have the barriers of credibility concern, … , do not have time to check the origin, credibility, truthfulness etc. of the information they …",https://www.degruyter.com/document/doi/10.1515/opis-2019-0019/pdf,"https://scholar.google.com/scholar?q=related:QGTTWoSOd40J:scholar.google.com/&scioq=%22fake+news%22%7C%22false+news%22%7C%22false+stor*%22+%22accuracy%22%7C%22discernment%22%7C%22credibility%22%7C%22belief%22%7C%22suceptib*%22&hl=en&as_sdt=0,5&as_vis=1"
,21,"B Han, X Han, H Zhang, J Li, ...",Fighting fake news: two stream network for deepfake detection via learnable SRM,2021,IEEE Transactions on …,ieeexplore.ieee.org,https://ieeexplore.ieee.org/abstract/document/9377486/,"https://scholar.google.com/scholar?cites=4512650853665831724&as_sdt=2005&sciodt=0,5&hl=en",744,3/2/23 10:43,,,,,,,,,21,10.50,4,5,2,… Fake news is mainly the rumors spread on the internet in both text and multimedia format. As fake news is … -of-the-art by %2 in accuracy. The main contributions of our work are two-fold: …,,"https://scholar.google.com/scholar?q=related:LHsd2AoooD4J:scholar.google.com/&scioq=%22fake+news%22%7C%22false+news%22%7C%22false+stor*%22+%22accuracy%22%7C%22discernment%22%7C%22credibility%22%7C%22belief%22%7C%22suceptib*%22&hl=en&as_sdt=0,5&as_vis=1"
,31,"S Andı, J Akesson",Nudging away false news: Evidence from a social norms experiment,2020,Digital Journalism,Taylor &Francis,https://www.tandfonline.com/doi/abs/10.1080/21670811.2020.1847674,"https://scholar.google.com/scholar?cites=4863825944784191570&as_sdt=2005&sciodt=0,5&hl=en",745,3/2/23 10:43,,10.1080/21670811.2020.1847674,,,,,,,31,10.33,16,2,3,"… by defining false news, and by examining why false news is … the sharing and consumption of false news on social media, ranging … Asking users to rate the accuracy of an article may also …",,"https://scholar.google.com/scholar?q=related:UsAwWO3Hf0MJ:scholar.google.com/&scioq=%22fake+news%22%7C%22false+news%22%7C%22false+stor*%22+%22accuracy%22%7C%22discernment%22%7C%22credibility%22%7C%22belief%22%7C%22suceptib*%22&hl=en&as_sdt=0,5&as_vis=1"
,112,"ZF Chen, Y Cheng","Consumer response to fake news about brands on social media: the effects of self-efficacy, media trust, and persuasion knowledge on brand trust",2020,Journal of Product &Brand Management,emerald.com,https://www.emerald.com/insight/content/doi/10.1108/JPBM-12-2018-2145/full/html,"https://scholar.google.com/scholar?cites=14525502819472734874&as_sdt=2005&sciodt=0,5&hl=en",746,3/2/23 10:43,,10.1108/JPBM-12-2018-2145,,,,,,,112,37.33,56,2,3,"… about brands, consumers need to note the credibility and trustworthiness of the media channel where a piece of information is transmitted. It is important to keep in mind that information …",https://www.academia.edu/download/60907313/Chen___Cheng_Fake_News-Journal_of_Product_and_Brand_Management20191015-81041-uorge8.pdf,"https://scholar.google.com/scholar?q=related:mnqb2trzlMkJ:scholar.google.com/&scioq=%22fake+news%22%7C%22false+news%22%7C%22false+stor*%22+%22accuracy%22%7C%22discernment%22%7C%22credibility%22%7C%22belief%22%7C%22suceptib*%22&hl=en&as_sdt=0,5&as_vis=1"
,18,"E Georgiadou, H Rahanu, KV Siakas, C McGuinness, ...",Fake news and critical thinking in information evaluation,2018,,eprints.mdx.ac.uk,http://eprints.mdx.ac.uk/24364,"https://scholar.google.com/scholar?cites=10494502884464255932&as_sdt=2005&sciodt=0,5&hl=en",747,3/2/23 10:43,,,,,,,,,18,3.60,4,5,5,"… emotion and personal belief” (OED). In such circumstances, fake news finds fertile ground and appeals to emotions and personal beliefs. The Council of Europe defined fake news as, ”…",https://eprints.mdx.ac.uk/24364/1/BIHAC%202018%20Georgiadou%20et%20al%20,"https://scholar.google.com/scholar?q=related:vOPNasX2o5EJ:scholar.google.com/&scioq=%22fake+news%22%7C%22false+news%22%7C%22false+stor*%22+%22accuracy%22%7C%22discernment%22%7C%22credibility%22%7C%22belief%22%7C%22suceptib*%22&hl=en&as_sdt=0,5&as_vis=1"
,57,"CM Greene, G Murphy",Individual differences in susceptibility to false memories for COVID-19 fake news,2020,Cognitive …,cognitiveresearchjournal …,https://cognitiveresearchjournal.springeropen.com/articles/10.1186/s41235-020-00262-1,"https://scholar.google.com/scholar?cites=16484394386471306756&as_sdt=2005&sciodt=0,5&hl=en",748,3/2/23 10:43,HTML,10.1186/s41235-020-00262-1,,,,,,,57,19.00,29,2,3,"… Exposure to ‘fake news’ can result in false memories, with possible consequences for … , suggesting a true discrimination between true and fake news. In contrast, participants who merely …",https://cognitiveresearchjournal.springeropen.com/articles/10.1186/s41235-020-00262-1,"https://scholar.google.com/scholar?q=related:BMYQP1tVxOQJ:scholar.google.com/&scioq=%22fake+news%22%7C%22false+news%22%7C%22false+stor*%22+%22accuracy%22%7C%22discernment%22%7C%22credibility%22%7C%22belief%22%7C%22suceptib*%22&hl=en&as_sdt=0,5&as_vis=1"
,12,"J Cao, Q Sheng, P Qi, L Zhong, Y Wang, ...",False news detection on social media,2019,arXiv preprint arXiv …,arxiv.org,https://arxiv.org/abs/1908.10818,"https://scholar.google.com/scholar?cites=4028496904510505126&as_sdt=2005&sciodt=0,5&hl=en",749,3/2/23 10:43,,,,,,,,,12,3.00,2,6,4,"… Accordingly, we define false-news image as a ached image in false news, and real-news … in the accuracy with which an automatic method can distinguish between false news and real …",https://arxiv.org/pdf/1908.10818,"https://scholar.google.com/scholar?q=related:pgAcPJcY6DcJ:scholar.google.com/&scioq=%22fake+news%22%7C%22false+news%22%7C%22false+stor*%22+%22accuracy%22%7C%22discernment%22%7C%22credibility%22%7C%22belief%22%7C%22suceptib*%22&hl=en&as_sdt=0,5&as_vis=1"
,7,"DZ Fitriyani, E Setia, M Lubis",Speech Function and Process in Fake News,2019,RETORIKA: Jurnal Ilmu …,pdfs.semanticscholar.org,https://pdfs.semanticscholar.org/32e1/919411b85589bbe6d2a1aa788d0d1ba672ac.pdf,"https://scholar.google.com/scholar?cites=11916210552205821944&as_sdt=2005&sciodt=0,5&hl=en",750,3/2/23 10:43,PDF,,,,,,,,7,1.75,2,3,4,"… their mind and belief toward their selection. In this research, the fake news about the political … The Twitter account @makLambeTurah is very active in spreading fake news and hateing …",https://pdfs.semanticscholar.org/32e1/919411b85589bbe6d2a1aa788d0d1ba672ac.pdf,"https://scholar.google.com/scholar?q=related:-Ef9yFziXqUJ:scholar.google.com/&scioq=%22fake+news%22%7C%22false+news%22%7C%22false+stor*%22+%22accuracy%22%7C%22discernment%22%7C%22credibility%22%7C%22belief%22%7C%22suceptib*%22&hl=en&as_sdt=0,5&as_vis=1"
,50,"T Gerosa, M Gui, E Hargittai, MH Nguyen",(Mis) informed during COVID-19: how education level and information sources contribute to knowledge gaps,2021,International Journal of …,ijoc.org,https://ijoc.org/index.php/ijoc/article/view/16438,"https://scholar.google.com/scholar?cites=3025160430648298265&as_sdt=2005&sciodt=0,5&hl=en",751,3/2/23 10:43,,,,,,,,,50,25.00,13,4,2,"… We first evaluated the dimensionality and factorial validity of the knowledge and fake news belief tests using confirmatory factor analysis (CFA). Specifically, we estimated a CFA that …",https://ijoc.org/index.php/ijoc/article/viewFile/16438/3438,"https://scholar.google.com/scholar?q=related:GQtcOWKH-ykJ:scholar.google.com/&scioq=%22fake+news%22%7C%22false+news%22%7C%22false+stor*%22+%22accuracy%22%7C%22discernment%22%7C%22credibility%22%7C%22belief%22%7C%22suceptib*%22&hl=en&as_sdt=0,5&as_vis=1"
,19,"F Wilson, MA Umar",The Effect of Fake News on Nigeria's Democracy within the Premise of Freedom of Expression,2019,Global Media Journal,globalmediajournal.com,https://www.globalmediajournal.com/open-access/the-effect-of-fake-news-on-nigeriasdemocracy-within-the-premise-of-freedom-ofexpression.php?aid=87578&view=mobile,"https://scholar.google.com/scholar?cites=1079600148103353353&as_sdt=2005&sciodt=0,5&hl=en",752,3/2/23 10:43,HTML,,,,,,,,19,4.75,10,2,4,… all kinds of news without fact checking to ensure source credibility is high and because of that the spread of fake news thrives more especially on virtual platforms. Since freedom of …,https://www.globalmediajournal.com/open-access/the-effect-of-fake-news-on-nigeriasdemocracy-within-the-premise-of-freedom-ofexpression.php?aid=87578&view=mobile,"https://scholar.google.com/scholar?q=related:CdQoX52C-w4J:scholar.google.com/&scioq=%22fake+news%22%7C%22false+news%22%7C%22false+stor*%22+%22accuracy%22%7C%22discernment%22%7C%22credibility%22%7C%22belief%22%7C%22suceptib*%22&hl=en&as_sdt=0,5&as_vis=1"
,16,"P Qi, J Cao, X Li, H Liu, Q Sheng, X Mi, Q He, ...",Improving fake news detection by using an entity-enhanced framework to fuse diverse multimodal clues,2021,Proceedings of the 29th …,dl.acm.org,https://dl.acm.org/doi/abs/10.1145/3474085.3481548,"https://scholar.google.com/scholar?cites=1275252894385364566&as_sdt=2005&sciodt=0,5&hl=en",753,3/2/23 10:43,,10.1145/3474085.3481548,,,,,,,16,8.00,2,8,2,"… Considering that fake news commonly tampers only one entity type to maintain credibility, we consider the multimodal news as entity inconsistent only when there are no aligned …",https://arxiv.org/pdf/2108.10509,"https://scholar.google.com/scholar?q=related:Vt6gOMCbshEJ:scholar.google.com/&scioq=%22fake+news%22%7C%22false+news%22%7C%22false+stor*%22+%22accuracy%22%7C%22discernment%22%7C%22credibility%22%7C%22belief%22%7C%22suceptib*%22&hl=en&as_sdt=0,5&as_vis=1"
,17,"RK Helm, H Nasu",Regulatory responses to 'fake news' and freedom of expression: normative and empirical evaluation,2021,Human Rights Law Review,academic.oup.com,https://academic.oup.com/hrlr/article-abstract/21/2/302/6129940,"https://scholar.google.com/scholar?cites=10796794259704700204&as_sdt=2005&sciodt=0,5&hl=en",754,3/2/23 10:43,,,,,,,,,17,8.50,9,2,2,"… understanding the psychological mechanisms that facilitate belief in fake news, and also facilitate its … This means that once people have an existing belief, they will have a bias towards …",https://www.tiesibsargs.lv/wp-content/uploads/migrate_2022/content/ngaa060_1614002486.pdf,"https://scholar.google.com/scholar?q=related:LN2s4izr1ZUJ:scholar.google.com/&scioq=%22fake+news%22%7C%22false+news%22%7C%22false+stor*%22+%22accuracy%22%7C%22discernment%22%7C%22credibility%22%7C%22belief%22%7C%22suceptib*%22&hl=en&as_sdt=0,5&as_vis=1"
,1,"M MadhuBala, AK Yadav, G Sucharitha, ...",A deep learning based algorithm design for fake news detection framework,2021,Annals of the …,annalsofrscb.ro,https://annalsofrscb.ro/index.php/journal/article/view/6212,"https://scholar.google.com/scholar?cites=13301693262011137419&as_sdt=2005&sciodt=0,5&hl=en",755,3/2/23 10:43,,,,,,,,,1,0.50,0,4,2,… fake news. Three different techniques are used in the detection of malicious advertisements. Social media data credibility … in order to improve accuracy in fake news detection. Towards …,https://annalsofrscb.ro/index.php/journal/article/download/6212/4739,"https://scholar.google.com/scholar?q=related:i31h4YsbmbgJ:scholar.google.com/&scioq=%22fake+news%22%7C%22false+news%22%7C%22false+stor*%22+%22accuracy%22%7C%22discernment%22%7C%22credibility%22%7C%22belief%22%7C%22suceptib*%22&hl=en&as_sdt=0,5&as_vis=1"
,1,"SM Singh, A Khadagi, S Sheikh, ...",Fake news detection: A survey,2021,… Research Journal of …,irjmets.com,https://www.irjmets.com/uploadedfiles/paper/volume3/issue_3_march_2021/7438/1628083317.pdf,"https://scholar.google.com/scholar?cites=1751064089289931575&as_sdt=2005&sciodt=0,5&hl=en",756,3/2/23 10:43,PDF,,,,,,,,1,0.50,0,4,2,"… model to detect fake news. Thus this … fake news detection models. The core idea is to gather, organize and understand there search information on desired project topic. The accuracy of …",https://www.irjmets.com/uploadedfiles/paper/volume3/issue_3_march_2021/7438/1628083317.pdf,"https://scholar.google.com/scholar?q=related:N7sR_YIHTRgJ:scholar.google.com/&scioq=%22fake+news%22%7C%22false+news%22%7C%22false+stor*%22+%22accuracy%22%7C%22discernment%22%7C%22credibility%22%7C%22belief%22%7C%22suceptib*%22&hl=en&as_sdt=0,5&as_vis=1"
,41,"A Silva, Y Han, L Luo, S Karunasekera, ...",Propagation2Vec: Embedding partial propagation networks for explainable fake news early detection,2021,Information Processing & …,Elsevier,https://www.sciencedirect.com/science/article/pii/S030645732100114X,"https://scholar.google.com/scholar?cites=3247883247229220891&as_sdt=2005&sciodt=0,5&hl=en",757,3/2/23 10:43,,,,,,,,,41,20.50,8,5,2,"… used to characterise the credibility of a user. Hence, we can conclude that Propagation2Vec focuses on the activeness and the credibility of users to detect fake news in the politics and …",,"https://scholar.google.com/scholar?q=related:GzgK95rMEi0J:scholar.google.com/&scioq=%22fake+news%22%7C%22false+news%22%7C%22false+stor*%22+%22accuracy%22%7C%22discernment%22%7C%22credibility%22%7C%22belief%22%7C%22suceptib*%22&hl=en&as_sdt=0,5&as_vis=1"
,11,N Ouedraogo,Social media literacy in crisis context: Fake news consumption during COVID-19 lockdown,2020,Available at SSRN 3601466,papers.ssrn.com,https://papers.ssrn.com/sol3/papers.cfm?abstract_id=3601466,"https://scholar.google.com/scholar?cites=4152146260125843326&as_sdt=2005&sciodt=0,5&hl=en",758,3/2/23 10:43,,,,,,,,,11,3.67,11,1,3,"… The methods of detection of fake news include both the writing styles and the credibility of the spreaders (the sources of information). However, in the digital age, the rise of social …",https://europepmc.org/article/ppr/ppr261230,"https://scholar.google.com/scholar?q=related:fn9ESgZjnzkJ:scholar.google.com/&scioq=%22fake+news%22%7C%22false+news%22%7C%22false+stor*%22+%22accuracy%22%7C%22discernment%22%7C%22credibility%22%7C%22belief%22%7C%22suceptib*%22&hl=en&as_sdt=0,5&as_vis=1"
,10,"A Giachanou, B Ghanem, EA Ríssola, P Rosso, ...",The impact of psycholinguistic patterns in discriminating between fake news spreaders and fact checkers,2022,Data &Knowledge …,Elsevier,https://www.sciencedirect.com/science/article/pii/S0169023X21000835,"https://scholar.google.com/scholar?cites=7902952064412899007&as_sdt=2005&sciodt=0,5&hl=en",759,3/2/23 10:43,HTML,,,,,,,,10,10.00,2,5,1,"… Fake news is a threat to society. A huge amount of fake news is posted every day on social … , some users share posts that debunk fake news by using information from fact-checking …",https://www.sciencedirect.com/science/article/pii/S0169023X21000835,"https://scholar.google.com/scholar?q=related:v1ZF7AftrG0J:scholar.google.com/&scioq=%22fake+news%22%7C%22false+news%22%7C%22false+stor*%22+%22accuracy%22%7C%22discernment%22%7C%22credibility%22%7C%22belief%22%7C%22suceptib*%22&hl=en&as_sdt=0,5&as_vis=1"
,69,"NA Atehortua, S Patino","COVID-19, a tale of two pandemics: novel coronavirus and fake news messaging",2021,Health promotion international,academic.oup.com,https://academic.oup.com/heapro/article-abstract/36/2/524/6101655,"https://scholar.google.com/scholar?cites=13512912195382551556&as_sdt=2005&sciodt=0,5&hl=en",760,3/2/23 10:43,,,,,,,,,69,34.50,35,2,2,… the community and the erosion in the credibility of genuine media. Public health practitioners … promotion and education interventions including plans to neutralize fake news messages. …,https://www.ncbi.nlm.nih.gov/pmc/articles/PMC7928890/,"https://scholar.google.com/scholar?q=related:BCTSFgyCh7sJ:scholar.google.com/&scioq=%22fake+news%22%7C%22false+news%22%7C%22false+stor*%22+%22accuracy%22%7C%22discernment%22%7C%22credibility%22%7C%22belief%22%7C%22suceptib*%22&hl=en&as_sdt=0,5&as_vis=1"
,41,"A Dey, RZ Rafi, SH Parash, SK Arko, ...",Fake news pattern recognition using linguistic analysis,2018,2018 Joint 7th …,ieeexplore.ieee.org,https://ieeexplore.ieee.org/abstract/document/8641018/,"https://scholar.google.com/scholar?cites=16568925058703842902&as_sdt=2005&sciodt=0,5&hl=en",761,3/2/23 10:43,,,,,,,,,41,8.20,8,5,5,"… fake news and also for the sake of welfare of the general public along with the news ecosystem, it’s crucial that we should develop systems to detect fake news … accuracy of 66.66%. The …",http://dspace.bracu.ac.bd/xmlui/bitstream/handle/10361/10139/13201055%2C13201070%2C13201030%2C14101233_CSE.pdf?sequence=1&isAllowed=y,"https://scholar.google.com/scholar?q=related:Vl4cEo6l8OUJ:scholar.google.com/&scioq=%22fake+news%22%7C%22false+news%22%7C%22false+stor*%22+%22accuracy%22%7C%22discernment%22%7C%22credibility%22%7C%22belief%22%7C%22suceptib*%22&hl=en&as_sdt=0,5&as_vis=1"
,85,"JCS Reis, A Correia, F Murai, A Veloso, ...",Explainable machine learning for fake news detection,2019,Proceedings of the 10th …,dl.acm.org,https://dl.acm.org/doi/abs/10.1145/3292522.3326027,"https://scholar.google.com/scholar?cites=11070269832052657563&as_sdt=2005&sciodt=0,5&hl=en",762,3/2/23 10:43,,10.1145/3292522.3326027,,,,,,,85,21.25,17,5,4,"… The literature is quite broad if we consider efforts related to information credibility, rumor detection, and news spread. Next, we conduct a systematic survey on these efforts aiming to …",https://homepages.dcc.ufmg.br/~fabricio/download/websci-reis-2019.pdf,"https://scholar.google.com/scholar?q=related:m804a8J_oZkJ:scholar.google.com/&scioq=%22fake+news%22%7C%22false+news%22%7C%22false+stor*%22+%22accuracy%22%7C%22discernment%22%7C%22credibility%22%7C%22belief%22%7C%22suceptib*%22&hl=en&as_sdt=0,5&as_vis=1"
,16,"C Soon, S Goh","Fake news, false information and more: countering human biases",2018,Institute of Policy Studies (IPS) Working Papers,lkyspp.nus.edu.sg,https://lkyspp.nus.edu.sg/docs/default-source/ips/ips-working-paper-31_fake-news-false-information-and-more_260918.pdf,"https://scholar.google.com/scholar?cites=9272330350248334331&as_sdt=2005&sciodt=0,5&hl=en",763,3/2/23 10:43,PDF,,,,,,,,16,3.20,8,2,5,… Recent studies looking at fake news stories circulated on social media during the 2016 US Presidential Election also found that people’s belief in fake news stories became stronger as …,https://lkyspp.nus.edu.sg/docs/default-source/ips/ips-working-paper-31_fake-news-false-information-and-more_260918.pdf,"https://scholar.google.com/scholar?q=related:-xOgnlPvrYAJ:scholar.google.com/&scioq=%22fake+news%22%7C%22false+news%22%7C%22false+stor*%22+%22accuracy%22%7C%22discernment%22%7C%22credibility%22%7C%22belief%22%7C%22suceptib*%22&hl=en&as_sdt=0,5&as_vis=1"
,45,"L Hu, T Yang, L Zhang, W Zhong, D Tang, ...",Compare to the knowledge: Graph neural fake news detection with external knowledge,2021,Proceedings of the …,aclanthology.org,https://aclanthology.org/2021.acl-long.62/,"https://scholar.google.com/scholar?cites=18140021721422080479&as_sdt=2005&sciodt=0,5&hl=en",764,3/2/23 10:43,,,,,,,,,45,22.50,8,6,2,… Propagation-based approaches for fake news detection are based on the basic assumption that the credibility of a news event is highly related to the credibilities of relevant social …,https://aclanthology.org/2021.acl-long.62.pdf,"https://scholar.google.com/scholar?q=related:36k7S6VNvvsJ:scholar.google.com/&scioq=%22fake+news%22%7C%22false+news%22%7C%22false+stor*%22+%22accuracy%22%7C%22discernment%22%7C%22credibility%22%7C%22belief%22%7C%22suceptib*%22&hl=en&as_sdt=0,5&as_vis=1"
,24,EA Dumitru,Testing children and adolescents' ability to identify fake news: a combined design of quasi-experiment and group discussions,2020,Societies,mdpi.com,https://www.mdpi.com/832644,"https://scholar.google.com/scholar?cites=17511839487817203804&as_sdt=2005&sciodt=0,5&hl=en",765,3/2/23 10:43,,,,,,,,,24,8.00,24,1,3,"… of the fake news phenomenon and to the study of children’s ability to identify fake news. It … Fake news is a phenomenon that gains credibility by hiding behind the mask of legitimacy, …",https://www.mdpi.com/2075-4698/10/3/71/pdf,"https://scholar.google.com/scholar?q=related:XMAAgzuNBvMJ:scholar.google.com/&scioq=%22fake+news%22%7C%22false+news%22%7C%22false+stor*%22+%22accuracy%22%7C%22discernment%22%7C%22credibility%22%7C%22belief%22%7C%22suceptib*%22&hl=en&as_sdt=0,5&as_vis=1"
,27,"I Vogel, P Jiang",Fake news detection with the new German dataset “GermanFakeNC”,2019,Digital Libraries for Open Knowledge: 23rd …,Springer,https://link.springer.com/chapter/10.1007/978-3-030-30760-8_25,"https://scholar.google.com/scholar?cites=13575737409394842019&as_sdt=2005&sciodt=0,5&hl=en",766,3/2/23 10:43,,10.1007/978-3-030-30760-8_25,,,,,,,27,6.75,14,2,4,"… of high credibility and acceptance. According to Rubin et al. [11], different sub-types of fake news … [9] extend the categories of fake news by the format “propaganda”. This genre uses true …",,"https://scholar.google.com/scholar?q=related:oxn2Gj-1ZrwJ:scholar.google.com/&scioq=%22fake+news%22%7C%22false+news%22%7C%22false+stor*%22+%22accuracy%22%7C%22discernment%22%7C%22credibility%22%7C%22belief%22%7C%22suceptib*%22&hl=en&as_sdt=0,5&as_vis=1"
